Sender_Name,Sender_Email,Recipient_Email,Subject,Email_Body,Timestamp,Has_Attachment,Attachment_Type,URL_Count,URL_Domains,Email_Client,Language,Label
Jason Lindsey,susanrobinson@yahoo.com,mjackson@burton.com,Particular travel land participant federal.,Could forward occur quickly tend today focus. Project pattern part trip. Cultural thousand return call significant road leave. Stop run quality leader well. Month within take your way official. Play rate cause.,2025-03-27 07:36:36,True,zip,4,"oconnor.com, leon.org, scott-mckinney.org, morrison.info",Apple Mail,en,legitimate
Jessica Walter,harrisandrew@smith.org,sthompson@gmail.com,Matter because create later southern board one.,Apply she push loss right candidate attention. Boy feeling fine value lose recent land. Short interview perform seven.,2024-10-21 00:03:52,True,none,7,"simon-martinez.biz, french-holt.net, richmond.com, burke.info, collins.com, perry.com, price.net",Outlook,en,phishing
Willie Ingram,rmedina@johnson.com,gordonamy@hart.com,Piece phone tend form fish white.,Shoulder seek black wall. Have between minute feeling compare. Cold remember town ready culture maybe us. Protect power market inside crime another far natural. Major ago environment loss main company. In number white wrong. His course health personal.,2024-11-15 04:20:56,True,none,9,"moses.info, joseph.com, cox.com, fernandez-bond.org, powers.com, wilson.info, duncan-porter.info, brown-rosario.com, johnson.com",Apple Mail,es,phishing
Misty Stevenson,leonallison@brown-anderson.net,catherine45@ramos.com,Music evening huge put.,Someone poor professor quite forward free. Last clear type provide believe. Management thousand begin yourself left painting set.,2024-11-02 09:17:45,False,none,8,"burns.net, liu.org, odom.net, evans.info, hernandez.info, sanchez.com, murray.net, nguyen.com",Thunderbird,en,phishing
Julian Cline,chavezbrandon@hotmail.com,ricekaitlyn@yahoo.com,I third them vote direction.,Group bit us force can true. Establish adult born beyond compare choice energy. Between according hair born.,2025-03-10 00:03:16,True,none,10,"mitchell.com, wolf-snow.info, fitzgerald.com, miller.com, harris-smith.com, spencer.net, rose-gutierrez.org, keith.net, parrish.info, todd.biz",Outlook,zh,legitimate
Steven Hernandez,rogersamanda@giles-bush.org,smithelaine@white.com,Thank college none race material.,Hear history another view memory you. Maintain sing past pull poor sound recent. Southern fight others pass of peace same. Provide minute blood scientist article event senior. Central sometimes personal truth world.,2024-05-14 22:54:01,True,pdf,1,collins.com,Outlook,de,legitimate
Erika Washington,sodom@yahoo.com,joshua52@yahoo.com,Team less enough adult seven.,Every treat create room style green. Tough trip series oil reduce. Since if several black sell cause front. Six late late development safe.,2024-11-25 14:25:41,False,none,8,"hartman.com, brown-palmer.net, callahan.info, rodriguez.biz, cooper-harvey.biz, smith-burgess.org, sosa.info, sampson.net",Thunderbird,fr,legitimate
Debbie Lopez,williamsanchez@hotmail.com,jennagentry@morse-lynch.info,Explain high actually guess lose almost.,Different force where nation. Modern relationship style already too truth agency. Certainly sort Democrat either continue improve. Stock century experience quite.,2024-11-25 01:36:35,True,zip,10,"smith.info, lara-green.net, nichols.com, barber-wood.com, moody-stone.org, hall.com, francis.net, wilson.com, woodward.org, robinson-cardenas.com",Thunderbird,de,legitimate
Jacob Kent,brownrebecca@armstrong.biz,charlesgarcia@mitchell.com,Fall choice simply step protect.,Beyond official go impact half name condition. North make laugh laugh. Myself change all fire list now usually. Run adult occur particular prevent walk international dinner.,2025-01-07 08:59:59,True,xlsx,0,,Thunderbird,en,phishing
Virginia Coleman,hayley17@hotmail.com,turnerangie@hotmail.com,Body reduce need wish.,Soon great about baby middle. Wind share including follow tree human. Model partner amount PM. Moment heart film every force create camera. Local your say mean like daughter staff nature.,2024-11-18 21:42:22,False,none,9,"brown-young.com, reed-escobar.com, snyder.biz, campbell.info, white.net, hill-young.com, barrera-jones.org, case.com, smith.com",Thunderbird,en,phishing
Mark Crawford,johnsonrobert@lee.com,adamadams@yahoo.com,Know send difference dinner bank red trade.,Leg word black main he doctor write. Single lawyer also across meeting act country. Pick always section teacher decide ask thought call. Standard political wait husband onto. Year necessary page. Picture write large reach several bad.,2025-01-19 19:30:50,False,none,0,,Gmail,en,phishing
William Thompson,swright@rivera-cook.com,allenbenjamin@hotmail.com,Teach business forget would.,Possible technology her research ground learn good can. Season big civil bed what maybe. Loss power word baby campaign list.,2025-02-20 15:00:08,True,exe,10,"soto.com, calhoun.com, green.com, clark.com, hess.com, gomez-chapman.com, booth.com, foster-lewis.com, johnson.com, clark.net",Yahoo,de,legitimate
Rachel Jackson,lopezcandice@sharp-wells.com,qbrown@yahoo.com,Prevent dinner police decide feel trip bill poor.,Scene discussion foreign total. System purpose second oil. Political board radio big front. Tell agreement your remember serious. Front draw smile research class understand.,2024-04-18 23:25:40,False,none,5,"allen-white.com, murray.com, rodriguez-stewart.com, ingram.com, hernandez-romero.com",Apple Mail,zh,phishing
Joe Byrd,buchananandrew@wright.com,michellesanchez@yahoo.com,Traditional trip us stuff any term impact.,First respond impact. Rise road many little hard. Whole political during science her. Conference full carry. Voice thought throw read chance. Card anything speech station through recognize bring that.,2024-07-05 10:37:46,True,docx,4,"wilson.biz, porter.net, rodriguez.com, robles.com",Apple Mail,fr,phishing
Traci Mason,patriciareeves@carlson.info,markwhite@hotmail.com,Story culture military.,Season theory no project lose. System board it let anyone. Rate agent above whatever production social husband. What green chance early because kitchen. Than involve write common. Today beautiful statement side each.,2024-11-08 16:17:51,True,none,8,"matthews.com, peterson.net, kim-underwood.com, burns.net, golden-banks.info, young.com, reilly-simpson.info, bailey.com",Thunderbird,de,phishing
Eugene Young,mark50@hotmail.com,benjaminbrooks@yahoo.com,Technology worker over test way.,Maintain certain either instead us cultural people. Interest only economy team produce hotel mention thought. Prevent describe buy onto both picture someone. Treatment but whether pay eight.,2025-02-07 12:35:53,False,none,8,"fleming-scott.biz, benitez-clark.com, parrish-peterson.com, campbell.info, dudley.com, nelson.org, gutierrez.com, travis.biz",Thunderbird,de,legitimate
Charles Ramirez,tjohnson@gmail.com,robertbutler@hotmail.com,Human night dog character summer event.,Sometimes likely keep science money call whose. Film wait determine purpose little. Growth save few bad figure result. Particularly information hair. Resource without perform painting.,2025-03-06 03:38:53,False,none,5,"morrow.com, oliver-koch.org, reynolds.com, deleon.com, price.com",Yahoo,en,legitimate
Tiffany Williams,oboyd@yahoo.com,wintersgina@bell-mcgrath.net,Foreign everything reach walk final explain.,Main produce travel upon that toward bit. Wall order time want ask several but. Scene thank law note fish and.,2024-11-29 03:56:56,True,pdf,8,"edwards-gomez.net, cunningham.com, gardner.com, park-savage.biz, miller-rogers.com, fry.info, mclaughlin.info, coleman-black.info",Yahoo,fr,legitimate
Frances Banks,jordanjennifer@gmail.com,james03@gonzales.com,Democratic and five.,Light only believe five part different season. Student it hold eye kitchen pass family. Whole cultural actually friend cell.,2025-01-31 09:08:02,True,zip,10,"parker-johnson.com, ritter.info, lopez-adams.com, rojas-bailey.com, harrison.com, solis.com, torres.com, riley.info, walker-simmons.com, li.org",Yahoo,zh,phishing
Deborah Ortiz,stevenduke@yahoo.com,joangalvan@harrison.com,Account some training difficult trouble thus.,Total still clearly my experience situation. How respond medical. Share notice check back onto. I program apply really live sense.,2024-12-07 03:26:25,True,exe,7,"willis-lindsey.com, griffin.com, cruz-hutchinson.org, kennedy.com, flores-murillo.com, kirk-jackson.info, stewart-stanley.info",Thunderbird,de,legitimate
Felicia Clements,stephanie81@gmail.com,jessicaromero@farley-davenport.biz,Eat by who fall generation drop agency fine.,Real society often everything customer true. Thank could under gas open seek. Language smile but across store fire also. Ball nice possible statement foreign try station.,2025-02-20 08:02:06,False,none,4,"wall.net, adams.com, patterson.com, mcclure.net",Thunderbird,fr,legitimate
Sarah Freeman,barbara59@hotmail.com,johnbell@martinez-webb.net,Theory coach conference high contain memory.,Wife several understand let level church. Likely authority set nation risk lawyer. Wife the own group message summer recognize lose. Agree do third growth much ball company. Husband book foot.,2024-07-17 16:04:56,True,zip,10,"stokes.com, patel.com, davila-solomon.org, scott.com, dominguez.info, adams-clark.net, hodge-johnson.com, baker-arnold.biz, abbott-johns.biz, martinez.com",Outlook,fr,phishing
Taylor Wells,daniellebrown@yahoo.com,bradleywilliam@thompson.biz,Natural still protect positive general success level.,Cut clearly eat enough alone few across. Small show treatment defense break theory fight thought. Mouth company office decade final heart manager. Environmental nature beyond manage movement.,2025-03-14 06:37:47,False,none,8,"francis.net, smith.com, brown-newton.com, garza.biz, valdez.org, phillips-brown.com, mathis.com, nguyen.org",Apple Mail,fr,legitimate
Susan Gray,yburnett@jones-taylor.com,christopher78@peters-singleton.com,Drive occur decision central whole you recent.,Method traditional blue. Stage movie former performance bank college full. Usually let identify staff list. Institution ready watch. Message give radio management. Organization four tonight north among gun performance.,2024-11-25 12:36:45,False,none,4,"dickerson-scott.com, mullins.com, cobb-williams.com, ryan-watkins.info",Gmail,zh,phishing
Denise Reed,david43@beard.info,julielopez@gmail.com,Many board police himself.,Team early around determine society late. Arrive pick management lawyer anyone. Important too like system week listen you. Rule should scientist money member rest stay less. Fight hot college of market scientist let individual.,2025-04-03 17:53:06,True,none,10,"morgan.com, russo-gill.biz, taylor.com, cunningham.net, smith.com, robertson.com, chan.com, bauer.com, gonzalez.org, rodriguez.org",Outlook,fr,legitimate
Shaun Wright,jennifermitchell@gmail.com,ysmith@gmail.com,Room this consider rich push.,Participant produce across. Lawyer start ability especially her relationship drop. Accept any draw region life bar hit. Side firm court poor bring. Lose prepare structure view nature.,2024-12-13 20:44:18,False,none,6,"calderon.com, meadows.com, barton.info, monroe.com, cabrera-taylor.com, pitts.com",Yahoo,en,legitimate
Geoffrey Richardson,echavez@hotmail.com,shahmark@yahoo.com,Everyone same plan mention baby.,Sister eight talk international little cold. Hand listen worker effect sort. Discover already question medical visit minute too beat. College close thousand. Radio up image item both always read black. Forget sport role.,2025-04-07 09:34:36,True,docx,6,"price-vazquez.com, collins.biz, williams.com, jones.com, campos.net, bryant.org",Gmail,zh,legitimate
Anthony Lindsey,debracarter@yahoo.com,amy55@johnson-jackson.com,Somebody call machine far tough risk.,Need conference religious former responsibility energy. Start human nor number friend much. Approach series away they song world. Five inside me community director style. Step economy TV little office value throughout ball. Wait note sort prove.,2024-10-17 03:02:23,True,pdf,5,"watson.org, zimmerman-reyes.net, newman.biz, fox.com, soto.biz",Outlook,zh,legitimate
Vanessa Preston,rachel83@yahoo.com,jose99@gmail.com,Free pay accept defense reason direction others.,Ever the never election. Half war class. If wrong second source. Direction agreement sing learn suddenly pay. Like commercial accept push choose up threat. Coach mean program opportunity a miss.,2024-07-23 12:38:04,False,none,5,"anderson.com, meyer-daniel.info, edwards.info, jones-johnson.com, perez.com",Outlook,es,phishing
Eric Martin,kimberlycosta@hotmail.com,james17@smith.com,Effort discussion down resource.,Boy cup environmental any class somebody. Writer food by modern hard. Newspaper often eat poor could long.,2025-02-21 07:42:22,True,zip,8,"torres.org, singleton.com, gutierrez.org, williams-andersen.com, keller.com, west.com, gonzalez.com, jones.com",Apple Mail,de,legitimate
Kristin Bell,bhill@miller.com,blee@graham.info,Again television myself wind treat.,Station station treatment increase explain method surface. Grow fact receive imagine loss grow government. Capital arm sometimes fire yet almost reality choose. Writer their air bring baby nation.,2024-05-08 21:13:38,False,none,1,norris-wu.com,Apple Mail,es,phishing
Lauren Fisher,ncastaneda@watson-gentry.com,iwilliams@saunders-richard.com,Hit among often all child certainly.,Certain who receive add former. Behavior student store sit tell. Address how above alone. Middle discover hot our pattern little.,2024-07-12 13:59:29,True,none,8,"sandoval-newman.info, morris.com, watson.org, lutz.com, reyes.org, mckay.com, gordon.com, ramirez-powell.com",Yahoo,zh,phishing
Timothy English,zmartinez@yahoo.com,rodneycook@smith-kim.com,Record son drop establish sister.,Provide water maybe field. Southern suffer provide resource. Position role begin forward weight. Want size purpose new fish.,2024-12-23 23:12:22,True,zip,3,"rogers-price.org, gonzalez.com, cameron.com",Apple Mail,de,legitimate
Andrea Gallegos,elizabeth65@hotmail.com,ryandiane@yahoo.com,Reason knowledge carry assume window next operation.,Wrong number yeah. Firm hard foreign. Civil administration quite nice behind one job. South I production training. Baby half word old physical. Still record final marriage fill. Against his agreement ever although operation.,2024-09-28 07:13:51,False,none,3,"hayes.com, gutierrez.com, sanchez.biz",Gmail,de,phishing
Stephanie Robinson,sandovalstephen@yahoo.com,kennethreeves@gallegos.com,Image word defense response trial thus.,Her particular various game. Year miss over. Become floor mother south table policy.,2024-07-19 09:38:11,True,zip,7,"reese.com, vaughn-park.com, walker.com, gonzalez.biz, tran.com, lewis.com, lopez.com",Apple Mail,de,legitimate
Annette Price,hodgesjason@newton.com,acarter@randolph.com,Speech little nothing bank president human activity.,Huge news term only protect between. Season perform open many hundred general someone. Body the nothing treatment. Staff chance music upon help music behind. Bed spring single box within former successful.,2025-04-03 22:53:29,False,none,6,"martinez-burton.org, weber-bowen.info, martinez-george.info, silva.com, hawkins.org, riley-brooks.info",Gmail,es,phishing
Brenda Dawson,angel93@blair.org,chapmanbrian@fisher.biz,Political focus lead production success water.,Imagine past result mission. Kitchen think more leader red process. Power million positive visit. Current home report first recognize simple early spring.,2024-12-06 05:43:32,True,pdf,2,"coffey-burch.info, allen.com",Gmail,en,phishing
Amy Perez,lauramiller@reilly-cobb.com,kylewells@turner-weber.info,Success else pressure lawyer song.,Teacher actually available attorney represent. Story small production kid serious evening. West your end serious else. Yard especially good particular recent bill. Yard per yourself peace fact natural.,2024-11-17 17:23:56,False,none,7,"johnson-bradley.com, rivera.com, davis.com, zimmerman-combs.biz, avila.com, smith.info, long.com",Apple Mail,de,legitimate
Anna Hood,dwilson@crawford.org,matthew65@dunlap-robinson.com,Tell get former long front.,Me how concern exactly TV again far make. Performance relationship for price answer change memory. Region chance TV east themselves yard parent. Stage stock its. Model author possible same idea pretty upon. Face something when also win daughter strategy present.,2025-03-22 20:23:59,False,none,6,"kaiser.net, massey.com, garcia-peterson.com, guzman-jones.net, miller.net, shannon-lyons.com",Thunderbird,en,phishing
Sharon Buck,gilmoresean@hotmail.com,shawjeffrey@holland.org,Risk onto first so role political back.,Many leg likely. Security near perform after daughter. Any turn style radio partner. Their serious field rock or throw carry. Recognize teacher whether.,2024-05-11 23:31:49,False,none,5,"wiley.com, gould.org, vega.org, woods-thompson.com, contreras-brooks.com",Gmail,de,legitimate
Annette Sawyer,cohenjennifer@gmail.com,butlerfernando@mcdonald.com,School institution run attorney.,Free push card detail chair. Worry support minute west experience. On project present few. Media rest boy baby blue.,2024-04-17 09:35:52,False,none,1,tucker-calderon.net,Thunderbird,es,legitimate
Andrew Lee,wlawson@guzman.com,weeksjill@gmail.com,Win American may bag get.,Child majority spend however. Still outside amount thus difference as determine perhaps. Common report message activity.,2024-04-15 23:01:16,True,zip,2,"edwards.info, jones.info",Gmail,zh,phishing
Carrie Schwartz MD,michaellittle@sanchez-carter.com,russellbrooks@mayer-campbell.org,Food travel woman guess.,Score reduce about stop college. Break brother main agency defense truth. Term feel score defense study like resource cut. Them three white mention what policy task. Certainly amount even evidence act. Resource truth office future.,2024-05-30 16:54:34,True,pdf,0,,Yahoo,en,legitimate
Brandon Beard,amyfisher@todd.com,bridget42@harris-owens.info,About walk fast enjoy.,Allow memory career Democrat. Ability through instead step yard toward myself note. Family sense yourself language report. Mother return strong budget.,2024-11-21 16:14:02,False,none,0,,Yahoo,zh,phishing
Joseph Matthews,xware@acosta.com,pcoleman@yahoo.com,Perhaps population great give entire north here.,Manage base line society coach. Goal great share someone why partner. Hope probably whose officer plant.,2024-05-05 03:15:28,False,none,9,"berg.info, cross-thomas.com, green-potts.org, franklin.com, johnson.com, ramos.info, young.com, torres.com, washington-bell.org",Apple Mail,en,phishing
Dana Kim,ybarnett@harrison.net,jduncan@fernandez.com,Development investment stage democratic scene result board late.,Alone practice hear relationship court interesting. Number store least traditional property sing social. Space she paper outside ability see case. Purpose ability support though. Policy throw catch summer true break. Knowledge religious agency major like officer catch.,2025-01-05 22:31:56,False,none,5,"walker.com, nichols.com, chaney.com, irwin-james.com, hughes.com",Outlook,es,legitimate
Tyler Russell,qmorris@gmail.com,austin48@gmail.com,Allow group show push inside.,Probably country these account senior. Accept present record might president. Buy my fly degree break.,2024-08-05 09:08:55,True,xlsx,0,,Thunderbird,fr,legitimate
Tina Wong,vicki28@hotmail.com,youngholly@gmail.com,Him science young order.,Say poor important finish call. Serious four call understand stand. Painting reduce treatment not heavy. Cost wish do edge beyond. Finish hear role above them. Everyone choice push glass when national place.,2024-11-07 09:53:57,True,zip,2,"harmon.com, bates.com",Gmail,en,phishing
Christina Rodgers,angela14@roberts.net,romeromary@yahoo.com,Yes approach media.,Tell occur final camera believe. Determine pay need size. To represent yes treatment then another exist. Type leave discover quickly. Institution five address rock measure range nice. Finally effort public.,2024-09-07 00:36:24,True,exe,2,"oconnor.info, spencer.com",Thunderbird,zh,phishing
Gabriel Michael,ingramdavid@yahoo.com,gonzaleztyler@hotmail.com,Others true around election property among special.,Us enter prove become seat worry should participant. Land agree surface side range property question. Available event or son owner. Once travel particularly citizen lawyer speech section. Mention throughout their put yeah. Strong western anyone.,2024-04-15 23:10:56,False,none,3,"sanders.com, parker-roberts.com, smith.biz",Outlook,es,legitimate
Mario Walker,amber38@hotmail.com,alexandermichael@moore-jones.com,Ok participant great effort matter choice value.,Hair else house. Person throw price still major. Source service political practice hand kind. When son tough involve expert staff. Nation country mention family cover. Billion sound society on growth.,2025-01-29 08:27:45,False,none,6,"yang-rasmussen.com, vance.org, nelson.com, webster.com, mcmillan.com, abbott-mosley.com",Thunderbird,de,legitimate
Daniel Mora MD,rebecca60@stewart.com,henry82@randall.info,Step sit between knowledge until.,Across administration economy mission wife in tree on. Technology to brother work program name seat. Question modern strong expect hundred quite single those. Arrive line main determine.,2024-10-17 13:25:27,True,none,3,"good.com, reed-doyle.com, clark-freeman.com",Apple Mail,en,legitimate
Dawn Peterson,whitecharles@hotmail.com,ngibbs@parker.com,Affect same watch protect determine why threat.,Politics couple wonder mean nature. Entire degree social foreign Congress according attack. Anyone conference within conference water. Learn last focus economy bank water central.,2025-04-01 19:35:23,False,none,2,"brown.biz, kelly.com",Apple Mail,zh,phishing
Kayla Hill,shortdaniel@farrell.org,pturner@stevens.biz,Believe myself candidate building.,Idea community him parent attack world kind. Voice fight mother it. West career order lay TV human. Challenge idea analysis officer. Tough painting blood find catch. Garden bill machine tend Democrat alone.,2024-10-10 17:52:58,True,none,0,,Yahoo,es,legitimate
Robin Kelley,norrisbrandon@hotmail.com,joseph89@yahoo.com,Participant street bank night.,Put protect town do world avoid. Set billion contain learn. Middle very though democratic. Back same likely upon. Beyond summer sport soon police middle.,2024-07-14 09:17:42,True,exe,9,"humphrey.biz, lloyd-guzman.com, gordon.com, sparks.com, moore-hall.com, ryan.com, scott.biz, campbell.com, carroll.com",Gmail,fr,phishing
Elizabeth Washington,connie15@gmail.com,hurstrebecca@jackson.com,Population no bring democratic able woman.,Then movement nor fill tell writer. Production role reflect pass. Name improve right. Service parent my long question despite onto.,2025-01-05 01:25:54,True,zip,8,"baker.com, moreno.com, raymond-williams.com, fisher-campos.com, cobb.com, kline-freeman.biz, thompson.com, thompson.com",Yahoo,es,legitimate
Sean Khan,josephpark@yahoo.com,christine50@gmail.com,Course gas team sell responsibility contain case.,Possible wait focus meet. Economy before side instead season matter. Bar thousand finish drop military. Change score involve man. Eye common while billion.,2024-11-05 22:04:36,False,none,7,"andrews.info, juarez.com, howard-cameron.com, mason.com, moore-barnes.net, martin.net, manning.com",Thunderbird,es,phishing
Michael Phillips,richard93@wheeler-cameron.net,ebyrd@yahoo.com,Particularly leg who parent but debate.,Kind he hard memory enter. Letter fine least always statement lead body. Oil claim free field. Until hand today develop help use fine there. Discuss foot guy.,2025-03-02 02:36:50,False,none,9,"ellis.biz, jones.org, fields-atkinson.com, henderson.biz, medina.org, anderson-juarez.org, campbell.com, mitchell.com, rosario.com",Apple Mail,es,legitimate
Paul Morgan,christina34@huffman.com,joshuagrant@yahoo.com,Reason stand study leave.,Defense summer central message strategy that. Through art clear. Attention any which score among whether coach pick. Vote federal shake heavy something budget same. Everyone play part task recently line.,2024-12-25 23:24:20,True,xlsx,10,"brown-welch.com, douglas-lee.com, anderson.biz, williams-clark.com, love.com, howell.com, cooper.com, reyes.com, edwards.com, mercer-jimenez.org",Apple Mail,es,phishing
Jeffrey Fuller,jrobinson@hotmail.com,allisonstokes@gmail.com,Late like last almost collection.,Today health investment leg course fill. Pull group beautiful glass fine over. Let authority successful official water. Leader spring education everybody. Guess many final director evidence gun offer. Wind body couple detail want simply.,2024-12-11 20:59:35,False,none,2,"brock-ali.com, harper.com",Gmail,de,phishing
Christopher Nelson,dclark@rice.com,charles25@york.biz,Ground or serious no.,Clearly explain day. Itself else concern trouble. Month decade environmental outside feel deal here.,2024-05-10 20:54:44,False,none,7,"moore.com, andrews.com, spencer.com, beard-day.com, barber.info, rangel.com, fry.com",Thunderbird,en,phishing
James Kelly PhD,gonzalezevan@yahoo.com,maddoxcorey@adams.com,Budget require miss major Congress.,Ground nearly often along. Reach such including only task these stand population. Address week loss voice tax before.,2024-05-30 08:13:19,False,none,3,"nelson-harris.info, cardenas-bailey.com, davis.biz",Gmail,es,phishing
Stacey Clark,gcallahan@cooper.com,victoria63@yahoo.com,Executive produce floor very happy strategy per.,Foreign watch society simply better. President purpose prepare wind. Cup medical hair unit involve Mr hit.,2024-05-08 09:17:35,True,none,7,"cabrera.com, everett.info, riley.com, brown-moody.biz, richard.com, bennett-roach.org, perez-mccullough.com",Apple Mail,fr,phishing
