Sender_Name,Sender_Email,Recipient_Email,Subject,Email_Body,Timestamp,Has_Attachment,Attachment_Type,URL_Count,URL_Domains,Email_Client,Language,Label
Stephanie Warren,ywilson@hotmail.com,johnnyjennings@mccarty.com,Drop feeling increase four short especially friend defense.,Argue soon visit according receive. Create former usually vote college factor can different. Final lawyer risk rock million. Stand success off school even standard.,2024-07-30 04:29:03,True,exe,7,"lawson-lambert.info, richardson.com, garcia-griffith.com, foster.net, foster-ellis.com, williams.com, grant.com",Gmail,en,phishing
Crystal Orozco,stanleymichael@hotmail.com,laura63@yahoo.com,Pattern into year go say political.,Head black specific if through suffer two. Suggest social view scene item. Bill record respond exist trade.,2024-11-18 10:53:00,True,none,4,"powell.com, howell.info, baxter.com, walker.info",Gmail,zh,legitimate
Catherine Stanley,brownallison@nelson.org,zharris@collins.net,Amount society present country thought then it.,Thing hope short debate. Most top past huge area each. Upon and model involve. Wish hit year management east air natural fire.,2025-03-18 08:19:52,True,docx,8,"dunn.info, lee-arellano.com, greene.info, murray-silva.com, humphrey.biz, hall.com, moon.com, davis-horton.org",Outlook,en,legitimate
Jaclyn Martin,mark47@holt.com,david99@hotmail.com,Large heavy growth official season.,Social six his series join to young. Themselves general among. Kind stand almost end such quite. Ten professional late real thought put.,2024-11-30 07:03:31,True,none,0,,Gmail,fr,legitimate
Alexander Myers,ebridges@hotmail.com,john19@yahoo.com,With economic movement message really from.,Far their son significant. Budget store region wonder education. Eat serious same cover. Respond station arm win.,2024-05-10 10:58:53,False,none,2,"rice.biz, sanders.net",Apple Mail,de,phishing
Robert Evans,ethanjackson@murphy.org,voliver@gmail.com,Or politics its themselves always.,Room until wind they both free few. Significant model next work. Director quality difficult produce successful now. Choice our suddenly game save radio claim member.,2025-02-12 19:46:47,True,zip,1,walsh.info,Thunderbird,zh,phishing
Julie Meadows,cameronmiller@gmail.com,tjenkins@koch.net,Hear career party mention green third.,Win avoid floor history laugh rest. Prepare collection wall show they fall turn fire. Particular sea American truth girl this. Commercial on while very information popular. My give ten involve music half tend. Fly safe individual close data expert.,2024-04-21 02:50:54,True,zip,5,"daniels.info, frank.net, turner.com, wagner.com, cooper.com",Gmail,es,phishing
Nathan Dean,mreed@gmail.com,lopezwilliam@gmail.com,Begin company at large.,Anything land popular. Fire above enter anyone top per cultural. Wonder second free major month quite agent. Simply of price it.,2025-02-08 17:32:47,True,zip,10,"white-cole.com, andrews.info, espinoza.com, allen.com, walker-simon.biz, may-garcia.com, hines.com, edwards-smith.org, bennett-edwards.com, oconnell.org",Apple Mail,es,phishing
Crystal Baldwin,greenejason@yahoo.com,guerrajessica@chen.com,Number less lot pressure stand.,Ability involve president than none difference certainly. Defense herself avoid. Factor almost rate money see. Can free left defense radio personal.,2024-11-08 10:36:20,False,none,9,"white.org, beard.com, wright.com, rangel.com, white-tyler.com, williams.com, roberts.com, mcmillan.info, smith-washington.biz",Gmail,zh,legitimate
Tina Black,wagnerstephen@martin.biz,burnssherry@miranda.com,Read discover meeting would child.,Level seat measure condition animal message suggest radio. Rather into rule among left lead life. It green matter look different upon yes. Teacher crime themselves sell message. My apply effect attention. Rule break recognize chair student.,2024-09-23 04:06:59,False,none,4,"gilbert-russell.com, johnson.biz, chavez-gonzalez.net, snow-johnson.com",Gmail,en,phishing
Brittany Castaneda,larry98@yahoo.com,kathleenhart@arnold.biz,Represent one use fine huge hand.,Drug although what institution close now machine. Television course forget local anything control. Reality court live sound produce detail.,2024-11-24 22:12:47,True,none,2,"burnett-bowen.com, oliver-arellano.com",Outlook,zh,phishing
Joseph West,alvarezangela@hotmail.com,jeffrey03@gmail.com,Plan space director size tell down.,Strong teacher teacher experience address people buy. Television voice seem store. First organization seek our paper simply even. Return risk live. Parent artist officer each air first.,2024-09-17 20:44:34,True,pdf,3,"robinson.org, bartlett-chen.com, hess.org",Thunderbird,de,phishing
Krista Garner,patrick94@woods-brown.com,millergarrett@gmail.com,Kind trip morning reveal anything represent.,Series option year. Season house beautiful film particularly. Fish wish conference attack all result boy. Value final whether difference manage.,2025-01-22 04:27:33,False,none,2,"smith.com, mcdonald.org",Gmail,en,phishing
David Davis,fernandezsherry@yahoo.com,bensonsara@spencer-leblanc.org,Not money available true listen especially analysis stock.,Detail all civil bed dark put rate. Race at one paper. Woman born let paper. Health weight remain work challenge health. Evening hot skin.,2024-07-15 19:21:28,False,none,0,,Thunderbird,fr,legitimate
Alexander Larsen,valerie38@hotmail.com,lesliewilliams@gmail.com,Interesting plant big heavy already.,Process special discussion instead indeed behavior. Level partner foreign fish home perhaps rock newspaper. Another job form everything. Happy guy participant everyone its should. Lead half program. North bad prove central.,2024-05-16 03:03:44,True,none,0,,Yahoo,zh,phishing
Karen Mcdonald,steven80@hotmail.com,brandon59@bond.info,Spend decade certain three.,Marriage easy magazine green situation. History suggest her peace rise. Order carry wife audience edge arrive which. Bad network Democrat summer our develop. Cup task consumer indicate will plan. Report better after season ok moment.,2024-09-05 15:00:06,False,none,0,,Gmail,fr,phishing
Robin Schwartz,fvalentine@gmail.com,michael09@hamilton.com,Bring interest customer picture.,Seem might crime edge. Edge main specific option. Carry table election wind simply trade. Program today cover whose.,2024-12-17 16:34:49,True,xlsx,6,"higgins.com, hester-gould.org, fitzgerald.net, davidson.com, thomas.com, davenport.org",Outlook,es,phishing
Elizabeth Coleman,melodycohen@hotmail.com,linda96@hotmail.com,Heavy change cut call ground carry.,According research among discussion. Scientist policy partner. Middle daughter pressure husband product pull key. Bank physical special talk serve.,2024-04-23 23:05:41,True,docx,3,"lewis-rodriguez.net, castillo.com, weaver-smith.com",Apple Mail,en,legitimate
Connie Wong,zschneider@martinez.com,figueroahannah@hotmail.com,Next too bring car no region current.,Space field hope speak let. Hair too age nation choice. Let where raise even person. Technology tax offer your prepare common hold. Couple threat lawyer expect. Member from degree candidate kind with.,2024-07-18 09:58:55,True,pdf,8,"villegas.com, martin.info, boone.info, burton.com, black.org, jordan-martinez.org, williams.org, ellis.biz",Yahoo,es,phishing
Elizabeth Perkins,nathan73@may.com,david77@gmail.com,Fire consider effort.,Enough later hair water way pull arm. System appear real can as. Anyone month person stuff surface employee dream. Shake exactly first design almost office.,2024-08-07 06:08:09,False,none,2,"herrera.com, floyd-le.com",Outlook,de,phishing
Dennis Rogers,chenjohn@hotmail.com,johnsontina@gmail.com,Lay positive agree.,Economic beyond system community reach return lawyer. Hit student much our include few meet day. Per bad truth week. Forward take type become seat feeling guy. World just of. Significant I fly all whether some these teacher.,2024-08-22 12:50:13,False,none,3,"daniels.org, nguyen.com, carpenter.com",Apple Mail,zh,phishing
Jacob Hudson,katiestanley@parker-navarro.info,joneshannah@gmail.com,Occur responsibility all consumer fly number.,Customer capital address wall reduce hour. Pm strong such fine according. Begin firm window director discover floor wear. Same staff sing difficult factor nation ready. Top family book my physical whose. Difficult already ground campaign.,2024-09-20 00:52:56,True,docx,10,"webster-turner.com, gutierrez.com, terrell.com, cole-tate.com, potter-williams.com, lopez.org, harris-edwards.com, taylor.com, harris.com, cooper.com",Thunderbird,de,legitimate
Tara Salazar,romanjennifer@rogers.com,robinsonbarbara@hotmail.com,However along theory field occur game little.,Stock student pull something build often. Trade indeed cost serious. Though food rise man parent pull.,2024-09-09 14:29:46,False,none,7,"campbell.com, robertson-crawford.com, knight.com, garrett-madden.com, downs.info, santos-thompson.com, moody.org",Thunderbird,zh,legitimate
Crystal Huynh,lunakristen@martinez.com,laurajimenez@moore.com,Know be cause simple shake act either.,Might form billion learn care serve serve. Culture job notice. Feeling hold amount about now believe top myself. Network agent kitchen stop. Decade quite agency. Lawyer air animal now the.,2024-12-13 16:55:50,True,exe,0,,Outlook,zh,legitimate
Barbara Meyers,timothy50@bright-stephens.info,walkeraustin@norman.com,Let method something rise.,Huge claim serve anything. Despite main heart summer one nice discussion. Perhaps body most maintain. He term door operation skill game discuss. Word leave wide. Put nothing protect stock player total.,2024-04-21 23:06:31,False,none,9,"rocha.com, ali-pineda.com, craig.org, nguyen-carpenter.info, harris-anderson.biz, moody-cunningham.info, bean-hayes.com, ferrell-henry.org, white.net",Gmail,es,legitimate
Roger Erickson,nathan30@hotmail.com,barnesdana@gmail.com,Customer cut easy easy test.,Clear direction police level. Even up this energy. Field nature sometimes. Race agency world prepare should until something. Store region call. Event during alone.,2024-07-27 10:32:09,True,exe,10,"barker.com, lane.info, dominguez-miller.com, mcmillan.org, underwood.com, rojas-young.net, thomas.com, williams-fernandez.net, rhodes-kemp.org, walton.com",Thunderbird,zh,phishing
Pamela Mercer,ibryant@pruitt.com,vgarcia@chapman.com,True free city course interesting serve investment.,Few school the free. Young down exist between hot. Special always job. Return how half pick strategy training.,2024-06-18 14:25:59,False,none,4,"simpson-riley.com, carpenter.com, clark.com, anderson.com",Thunderbird,fr,legitimate
Lisa Wright,pguzman@yahoo.com,barronrachel@gmail.com,Dog we identify should.,Quality seem sport image happy only. Evening through director rather major should mind somebody. Little participant window call spend. Today although later wish that. Certain everyone magazine international win. Husband former again customer son.,2024-10-17 23:40:07,True,pdf,3,"phillips.net, pena-manning.info, hoover.com",Yahoo,fr,phishing
Michael Byrd,dfloyd@jones-duran.com,wesley26@yahoo.com,Doctor never land time save.,Eight operation better. Draw prevent read billion then federal. Onto figure boy value conference main watch our. Cut piece several some environment crime.,2024-08-08 17:28:16,True,zip,8,"jackson-booth.info, james.com, charles-barnett.com, ward.com, freeman.com, anderson.com, morris-medina.com, powell-bray.com",Thunderbird,en,legitimate
Stephen Bell,courtneybennett@harris.org,marcia88@yahoo.com,Power word offer light word.,Cover son feeling career. Network another remember despite. Fine Democrat than inside. Reason describe collection for hospital. Thus black energy charge although.,2025-03-02 10:31:01,True,zip,8,"diaz.com, rodriguez.org, taylor.com, lee-yates.biz, ware.biz, graves.biz, ponce-nelson.com, mccullough.biz",Apple Mail,zh,legitimate
Jonathan Brown,thomasjohn@parker.com,bradleyfuller@branch.com,Produce approach education sell cell in.,Type blood exactly state. Remember positive education upon seek hospital around. Special always story by. Face certain describe collection remember once. Act then relationship toward tax. Physical decision maybe stage plan fund lose.,2025-01-14 07:25:39,False,none,5,"rodriguez.com, stanley-jones.com, erickson-mathis.info, gomez.com, richardson-martin.com",Outlook,zh,legitimate
Jason Lawson,tsmith@hotmail.com,bradley79@hotmail.com,Work author tax at affect.,Part thing rock soon miss suddenly available. Painting past action none. Structure growth develop such administration. Seat central enter close. Financial project action list may risk safe.,2024-04-08 19:02:44,False,none,1,taylor.com,Gmail,es,phishing
Brett Cruz,tduke@gardner-mcfarland.net,natashamoody@yahoo.com,Care while business.,Hand alone force since surface. Test light social newspaper address. When stand its soon account within. Part church them billion drop. Member tough set special reflect pressure glass analysis.,2024-11-04 04:43:51,True,xlsx,3,"west.info, sharp-benton.biz, steele.org",Gmail,fr,legitimate
Francisco Walker,katherinephillips@hotmail.com,michaelcampbell@gmail.com,Energy number where guess.,Away upon wife lead line decision. Cultural level world situation school to these. Interesting data though listen local only. Hotel forget arm hit daughter investment. Field employee current. Star during minute.,2024-12-15 21:23:36,True,xlsx,5,"black.org, wallace.info, patterson.net, cook.org, hendricks.com",Thunderbird,de,legitimate
Rachel Cooley,olynch@gmail.com,mayomelanie@hotmail.com,Market financial political north.,Simple store green evening language fight. Allow unit it movie collection public marriage. List total thing left series rock fine. Keep discussion front several style shoulder. After ten skin green artist hair lose. Hear film when do partner.,2024-11-08 10:32:52,True,zip,4,"mclaughlin.net, johnson.org, vargas.com, harrison.org",Yahoo,es,legitimate
Jennifer Johnson,jacobsdamon@lopez-graves.com,richard49@clark-santiago.com,Decade action hair hard court.,Operation standard others western my. Cup majority nation small few environment. Hair back least commercial.,2024-06-28 12:45:24,False,none,10,"olson.com, henry.biz, logan-holden.biz, morales.com, ponce.com, castillo.org, young.com, smith-richards.biz, jimenez.info, winters-burns.net",Apple Mail,es,phishing
David Hall,christinacooper@gmail.com,klinematthew@marshall.com,Money commercial kind main science.,Able under kid mother protect field soon. Close blue subject work politics place address. Start teach perform already. Morning meeting up letter discover teacher. Describe business give message least door president.,2024-12-15 01:29:02,True,pdf,1,fuller.com,Gmail,de,phishing
Sarah Willis MD,joshuathomas@becker.com,lucas54@yahoo.com,Mean direction citizen.,Image letter on. Western main democratic so surface author. Machine reality trouble six.,2025-03-23 06:33:10,False,none,0,,Thunderbird,de,phishing
Veronica Barker,kristinawolf@wheeler.org,markadams@murphy.com,Full beyond reality end its.,Manage able describe score crime treat. Painting affect home report upon direction without. Lay everybody new no expect available woman. Social sea who field office series. Accept food fight.,2024-10-25 22:35:32,False,none,8,"lewis.com, nichols-kelley.com, nguyen.com, townsend.net, clark-todd.com, johnston.net, burton.com, watkins-payne.com",Apple Mail,de,legitimate
Amy Zimmerman,drakecarol@hotmail.com,smallrichard@yahoo.com,Might out quality character suddenly until deep there.,State miss ten anyone behavior plant ability these. Thousand else general money. Child health her put beyond technology fear.,2025-04-05 10:50:13,True,exe,3,"allen-daniels.info, gallagher.com, boone-andrews.com",Apple Mail,fr,legitimate
Barry Mitchell,tgay@yahoo.com,christinayork@yahoo.com,Pick respond age all either attorney.,Total represent answer. Throw firm after international. Traditional take lot difficult relationship career personal.,2024-10-18 20:34:06,False,none,3,"smith.com, wilson.biz, fleming-murphy.biz",Thunderbird,zh,phishing
Taylor Robles,mitchellmark@hotmail.com,dawnhall@gmail.com,Catch nation shoulder film in look sell.,Already use design agent great. Hear woman find itself member role and. Parent toward method deal direction fall.,2025-01-16 12:36:09,False,none,3,"perkins-peterson.com, thomas-lewis.com, goodwin.com",Gmail,zh,phishing
Jessica Williams,craigreynolds@winters.com,jamessullivan@hotmail.com,Mean stock why statement past interest hair.,Easy stand compare democratic. Voice probably media green subject federal. Vote close day personal. Energy against whatever agent how area reach rate.,2025-03-21 20:09:52,True,pdf,3,"johnson.net, harris.com, martin.com",Outlook,en,legitimate
Elizabeth Taylor,hubbardmark@yahoo.com,jenkinsmichael@gmail.com,Adult TV school nature.,Doctor civil bed during. Enter dream staff picture nation federal. Couple agree expect health let.,2025-02-24 12:48:20,False,none,1,monroe.info,Apple Mail,en,phishing
Sherry Jacobs,miguelharris@gmail.com,brooksmanuel@hotmail.com,Less true network three senior others establish.,Senior stage member student throw develop. Treat partner deal cover information. Write compare national today bar through process long. Notice himself brother fine and. Expect almost thank ahead. Bad game there movement total ball very.,2024-05-06 14:30:46,False,none,0,,Apple Mail,zh,legitimate
Daniel Martin,thomasthomas@gmail.com,nchambers@gmail.com,Less stop season always.,Boy actually along song. Across public always national. Bag yard become newspaper door. Place whether art. Morning inside economic box which situation very. Summer do price check.,2024-11-23 14:34:35,True,none,2,"grimes.com, baker-black.com",Apple Mail,de,phishing
Ethan West,alexanderwarner@hotmail.com,stevengoodman@smith-richardson.com,Capital fall door.,Size rich federal fly leg individual against. Yourself sure administration bed third simply hard. Us administration serious him environmental none air information. Still people change less after face similar.,2024-05-23 10:48:44,False,none,10,"jackson.com, smith.com, cortez-johnston.biz, flores.com, smith.com, ellis-lewis.com, lee-jones.com, craig.com, olson.info, lewis.com",Outlook,zh,legitimate
Jennifer Olson,matthewgross@gallagher-cohen.com,mark66@gmail.com,Big hospital plan speak star yet.,A talk within world grow education. Agree box you visit yourself. Fill he hope power fire.,2024-11-11 07:06:33,True,xlsx,8,"perry-santana.com, randolph.com, williams.com, perez-moon.com, crosby.com, smith-cox.com, robinson.com, rice.com",Outlook,es,phishing
Scott Franklin,ysantana@hotmail.com,andrewmorton@mcgee-patel.org,Kitchen most write brother carry computer.,Small democratic standard center. Role plant behavior loss. Defense into across range husband effort final some. Interview former you thousand his property rich.,2024-06-06 12:00:36,False,none,4,"ballard.com, wright-warren.biz, gomez.com, tran-arnold.biz",Outlook,en,legitimate
John English,smartin@park.org,thomas48@grant.com,Care mean draw sea why level just.,Agree fly space time pay she. Space lead but information. Deal else education kitchen. Music city race send best. Mouth listen strong despite.,2024-09-03 21:46:25,True,exe,3,"perez.info, stephenson.com, mills-ferguson.com",Yahoo,es,phishing
Christine Gomez,moorestephanie@yahoo.com,arthur20@hotmail.com,Tonight collection grow camera.,Network party term great director may always bill. Effort scientist at space become. Improve financial area trouble.,2024-11-25 05:06:54,True,exe,1,cummings.com,Thunderbird,es,legitimate
Sonia Jenkins,andreabrock@hotmail.com,reneerios@gmail.com,Point to news action technology.,Center the off carry. On plant beautiful agreement develop stock. Store near fine cost against. Employee wait both garden.,2024-05-15 11:50:35,True,docx,4,"webb-ward.net, reeves.com, robinson.com, morales-jones.biz",Outlook,fr,phishing
Marcia Bullock,wilsondavid@walker.com,tbecker@yahoo.com,Property someone almost financial dog half.,Man class range actually protect box plant style. Name success his state really election option. Describe girl center law senior. Growth yes school feeling ground.,2024-10-04 02:32:57,True,docx,8,"johnson-black.com, howell.biz, greene-moore.info, hernandez.com, thomas.com, olson.net, howell.net, martinez.com",Yahoo,en,phishing
Lauren Ferguson,hectorellison@brown-olson.com,stephanierodgers@mullins.net,It instead toward who however many.,Challenge task after we. Argue friend industry keep. Security our their choice area. Sense thought front even find.,2024-06-02 21:59:24,True,zip,8,"valdez.com, bartlett-wilson.com, howard.com, curtis.com, lewis.net, white-vang.com, sosa.net, mcclain.com",Thunderbird,de,phishing
Tony Yang,vegadebra@gmail.com,russellbaxter@gmail.com,Beautiful investment home lose character science choose.,Why magazine strategy environment condition last. Role again common team deal energy. Behavior laugh treat become not that. Bed total less week. Identify safe turn really evidence else suggest. Successful matter occur good cause leg.,2025-01-07 06:29:22,True,docx,2,"rodriguez-jensen.biz, weeks.com",Thunderbird,zh,phishing
Calvin Andrews,dalejones@mueller.com,rcummings@stafford.com,Teacher sport cause total girl discover.,Whether increase particular against mouth list sense. Worry push agree wear claim picture. Poor wife gun. Cold step room consumer individual. Prove training number either consumer partner individual give.,2024-08-04 01:00:35,True,xlsx,3,"dean.com, irwin.org, kirby.com",Apple Mail,en,legitimate
Nicole Jordan,emartin@gmail.com,fryevincent@bird.org,Example sometimes environment significant worker home media.,Tv she scene cut current. Guy course really child. Entire little not population magazine drop. Watch find scene result. Likely dinner until build apply here enjoy.,2024-10-01 17:31:48,False,none,5,"rice.com, smith-jimenez.com, palmer-buck.com, meyer-perez.org, johnson-flowers.com",Yahoo,es,legitimate
Laura Hardin,michael62@moore.com,belljoel@gmail.com,Hot east garden wide smile full black.,Member impact research provide society get. Will hot occur surface. Toward yes enough study work loss future perform. East good information audience as respond outside serve. Care administration ok appear over establish. Tonight give collection various.,2024-08-17 03:40:49,False,none,3,"benton.com, frazier.com, roberts-henderson.info",Outlook,fr,legitimate
Paul Moore,hannah95@wells.com,woodardkimberly@yahoo.com,Someone or human grow firm present good.,Improve she key record. Sport hit water middle strategy truth job. Involve feeling energy impact government. Owner little level open expect as. Part seek bank. War imagine we yourself order.,2024-05-01 10:50:26,True,xlsx,0,,Gmail,zh,phishing
Madison Aguilar,melissagarza@gmail.com,chelseashah@ramirez.org,Pattern during white natural explain Congress.,Chair hear situation computer. Direction second position along. To board include teach.,2024-07-28 17:40:35,False,none,0,,Outlook,zh,phishing
Christopher Lewis,spencer82@hotmail.com,nicolas29@daniel-howard.net,Building meet occur present station write marriage.,Spring out wrong could detail. Animal soldier drug eight allow. Prepare low moment fine item. Care PM its wrong.,2024-07-11 13:47:02,False,none,2,"andrews.com, miller.biz",Gmail,en,legitimate
Laurie Fuentes,macosta@austin-moore.com,amber35@simmons-harrison.com,Often different south model spring image.,Nothing position several test imagine bank property. Food well with many anyone page seat. Feeling wear including. Room man meeting plan red. Recent run its write product. Their amount ball hospital crime why.,2024-12-20 10:30:45,True,exe,1,day.com,Apple Mail,es,legitimate
Jake Williams,james91@kennedy.com,yhenson@yahoo.com,Parent college medical behind.,Trip three price world approach might. Person month growth everybody understand town high. Feel issue other indicate voice later. Parent out song music imagine. Catch director scientist what produce performance keep list. Campaign side entire ready this because lawyer trade.,2024-07-19 20:55:17,True,exe,5,"vaughan.com, dixon.com, cortez.biz, edwards-shelton.com, woods.biz",Gmail,de,phishing
Dorothy Stevens,michelleandrews@gmail.com,toniross@evans-parsons.com,Class because learn participant newspaper control.,Eye worker relationship film management order though. There middle study wide dark so part. Heart so enjoy certainly lay change probably.,2025-03-30 14:07:48,True,none,5,"flores-vasquez.com, ross-gutierrez.com, myers.com, turner.com, martinez.com",Gmail,fr,phishing
Kelly Villa,juliesmith@gmail.com,ysmith@yahoo.com,Summer on meeting month face also another.,Life memory head field song traditional computer commercial. White see respond natural some bad. Parent draw less machine. Nice including inside beat fall why society.,2024-10-17 16:24:14,True,zip,8,"horton.com, blevins-morrow.com, hayes.com, collins.biz, sawyer.biz, jackson.biz, garcia-wright.com, holmes.com",Thunderbird,en,phishing
Samantha Dennis,hallkaitlin@moore.com,brian27@carlson.com,Officer along class apply per moment.,Garden material say maybe. Rate imagine wish. Wonder just four ten where. Without end among until color purpose candidate no. Recently back quite again.,2024-06-07 00:33:53,False,none,5,"thompson-francis.com, peterson.com, vincent.net, shannon.com, gallagher.net",Apple Mail,es,legitimate
Bill Chapman,wagneredward@clark-wright.info,samantha33@james.info,Simple few amount degree student stock pass.,Born must off high. Carry north night of. Education east even can beyond interview senior. Authority something fast dream already try heart candidate.,2024-11-29 21:14:01,False,none,8,"bell-mosley.biz, harris.org, jenkins-conrad.com, gardner.net, haynes.info, lynch-sloan.com, scott.net, ramirez.com",Gmail,es,phishing
