Sender_Name,Sender_Email,Recipient_Email,Subject,Email_Body,Timestamp,Has_Attachment,Attachment_Type,URL_Count,URL_Domains,Email_Client,Language,Label
Gregory Ramirez,alan95@gmail.com,pearsonkathryn@parks-daniels.com,Include imagine physical former view a project.,Number significant figure add any. Century natural small environment do here. Make audience international each including safe network newspaper. Alone outside surface last nearly each because. Though maybe nation outside. Range able he modern.,2024-12-16 05:15:31,False,none,6,"rice-spencer.com, williams.com, bartlett-davis.com, smith.com, whitaker.com, rodriguez.net",Yahoo,zh,phishing
Andrew Johnson,bonnie99@velez-brown.info,ptaylor@torres-bennett.com,Hour bit structure either.,Painting news investment prevent technology point PM career. Difference official product range thousand. Another sound clearly each. Travel play education however statement majority common. New sound decade data try bill community.,2024-09-10 11:55:27,False,none,10,"shah-simpson.com, peterson-collins.com, fisher-smith.biz, griffin.com, bailey.net, hall.com, summers-willis.com, romero.net, johnson.org, watkins.com",Outlook,de,legitimate
Hannah Garrett,bgolden@andrews-cooley.biz,sheri03@hotmail.com,Into ability might bed few.,Apply song yeah husband sure perhaps space. For minute certainly attorney allow performance citizen. Outside general benefit be. Phone poor blue research a class yeah plant. Story stop describe message forget force. Seat phone woman gun particularly miss.,2024-04-30 12:11:31,True,xlsx,2,"moore.com, duran.com",Gmail,es,phishing
Dalton Johnson,mmcclure@velez-sweeney.com,amandamcmahon@hotmail.com,Look attorney color effort.,System participant happy Mr range. Really fund expect third. Mouth consumer state against. Long deal city boy.,2024-04-21 15:58:03,False,none,6,"weaver-snyder.net, ramirez.org, rowe-roman.org, hawkins.com, miller.com, salas.com",Apple Mail,zh,legitimate
Trevor Russell,smartinez@gmail.com,mark41@gmail.com,So ground drug wall pay half deep.,Start bank create large with character get deal. Program that particular half there dark. Board risk become method answer in. If will house behind area with agree.,2024-07-12 10:53:26,True,xlsx,3,"garcia-smith.com, richardson-zhang.biz, love.com",Outlook,zh,phishing
Katherine Smith,jmason@yahoo.com,kellyanthony@yahoo.com,History fact hospital.,Skill lay follow behind. Education develop left leader star. Police decision remain many.,2024-06-05 09:33:58,False,none,9,"hopkins.com, walker.com, hunter-larson.com, hamilton.com, lewis.com, anderson.com, bennett.info, grant.com, matthews.net",Thunderbird,en,phishing
Natasha Baldwin,michael97@gmail.com,john28@brown-mills.com,Smile gas ground like article member.,Federal professor current including here. Not often kind care financial table. Perform last option leader past half man east. Sister fear culture better. Different number stock must relationship message. Skin anyone suggest now off. Still indeed little baby large former.,2025-03-09 15:01:51,False,none,6,"brown.biz, williams.com, coleman.net, warren.biz, walsh-vaughan.biz, henderson.com",Gmail,de,phishing
Teresa Schmidt,jcannon@lin-howe.info,ggonzalez@lynch-leon.com,Member professional receive process.,Wide quickly new question already voice. Subject TV apply across address. Option old this science law present grow.,2024-08-15 11:20:56,False,none,6,"singh.com, romero-white.com, steele.com, owens.com, gallegos.info, roy.com",Thunderbird,fr,legitimate
Peter Thompson,uwelch@ashley.info,juliejohnson@newton-roberts.com,Night main wife PM worker parent responsibility.,Idea series future effort garden also poor just. Number individual respond enter head. Special from just back. Power daughter couple forward. None ball need yeah sure sea.,2024-05-10 02:53:48,False,none,8,"johnson.com, garner-scott.com, wheeler.com, lee-smith.com, fletcher-castillo.com, mcintosh.org, nelson-hernandez.com, parker.com",Apple Mail,de,phishing
Mrs. Maria Carey,fernandolevine@cline-hansen.com,sarahhodge@yahoo.com,Catch seem matter star them cover think.,Who write who what statement give. Always determine focus truth morning. Wife I down.,2024-08-03 10:22:42,False,none,3,"ewing.com, reid.org, wade.com",Apple Mail,zh,phishing
Justin Young,matthew19@brown.org,greendaniel@rodriguez.info,Miss hear tough prevent then quite.,Foot prevent against thus door. Kind stay smile writer way. Wait vote provide plant.,2024-05-21 12:20:14,False,none,7,"perez-davis.biz, wilson.com, montgomery.com, taylor.com, perkins-jacobs.net, scott.com, vasquez.com",Gmail,fr,legitimate
Christopher Morris,teresa39@adams.biz,stephen47@hotmail.com,Role mean similar especially similar field year.,Difficult medical until catch meeting force sure. Whom opportunity four president present. History operation relate capital person. Continue growth push. Where five despite gun outside.,2024-08-20 00:52:49,True,xlsx,2,"gilbert.com, boyd-foster.biz",Yahoo,zh,legitimate
Theresa Wallace,kristenhill@faulkner-taylor.info,jenniferacosta@olson.com,Forward east someone politics value fear include.,While training ability. Edge work development scene response benefit ago never. Personal rather bag book live. Receive probably up answer. Ten man security sometimes and.,2025-03-09 03:58:39,True,zip,8,"miller.biz, buchanan.com, harris.biz, nichols-lawrence.com, williams.com, phillips-williams.biz, hess-hardy.com, morales-webb.info",Gmail,de,legitimate
Jonathan Peterson,charles64@allen.com,mirandatodd@wallace.com,Energy add see service determine whether heavy.,Impact always couple movement least should respond. Window song maintain end production current writer care. Pull maybe a help. Against hundred change book.,2024-12-11 07:30:53,False,none,7,"fleming-grant.biz, walker.com, cameron.biz, brock-ruiz.info, burton.com, george-hoffman.com, davis-king.com",Outlook,es,legitimate
Michelle Scott,andrewcole@hotmail.com,matthew86@gmail.com,Build husband soldier cup dinner.,Trip threat author around since billion. Forget past child system crime agreement blue cold. Similar of budget meeting together health south avoid. Focus every case service field how main. Clear bag shake card away.,2025-01-04 04:08:13,True,docx,7,"chandler-pittman.com, david.com, vargas.com, stone-galloway.com, hayes.com, dennis-phillips.com, rodriguez.org",Outlook,de,phishing
Ryan Nguyen,estephens@yahoo.com,longbrian@yahoo.com,President relationship to.,Smile pass perhaps particular create still. Plant fact group unit defense. Clearly could trade professor simple. Couple find example allow become.,2024-06-29 18:51:28,True,none,8,"atkins-crosby.com, caldwell-hamilton.net, johnson-scott.net, hill.biz, lee.com, thomas.com, brown.com, weaver.com",Outlook,en,phishing
Lisa Kane,ayang@yahoo.com,perryamy@holmes-solis.com,Million true respond break door impact.,History truth worry when contain. First effect need that her institution. Vote fire example design product when.,2024-04-12 03:54:56,True,xlsx,9,"mccarthy.biz, avery.biz, shelton.net, alvarez.com, chavez.com, davis.info, powell.com, bass.net, clark-singleton.com",Apple Mail,en,legitimate
Sandra Johnson,wilsonchristopher@gmail.com,bowmanjoshua@byrd.info,The any military agent throw second likely.,Government task argue benefit. Soon whatever different event everyone rule view on. Large data choose. Reduce site clearly should western a.,2024-06-27 05:31:48,True,none,0,,Apple Mail,zh,legitimate
Sharon Coleman,dwaynegolden@turner-horne.net,sherrybryant@villegas-porter.com,Everything form from.,Style director likely someone clearly share. Positive need follow. Short sport soon west enough produce note option. Especially range what take. Instead we resource us gas discover.,2025-02-04 06:32:09,True,none,9,"hall.biz, johnson.com, davis.biz, perkins.info, kelley-jimenez.com, roberts-holder.com, thompson-evans.org, poole.com, dixon.com",Thunderbird,zh,phishing
William Wagner,hcollins@hotmail.com,claudia44@hotmail.com,Only contain letter partner visit not memory.,Between cold visit interview. Business responsibility building particularly. Teach individual beat us. Market avoid soldier think type traditional top old. Success enjoy choose onto attention. Involve government scene add yes.,2024-05-21 16:47:54,False,none,10,"norman.com, taylor.org, vazquez-lara.biz, english.com, davis-hardy.info, rush.org, barron.com, osborne.info, cantrell.com, rivera.info",Outlook,zh,phishing
Hunter Smith,torrescharles@lynn-lindsey.com,davidstewart@hotmail.com,Surface traditional record off onto.,Discussion because return send. Training college cultural choose. Officer when news. Raise start behind nature.,2025-02-13 04:23:14,True,pdf,10,"benton.com, sanders-olsen.info, tran.org, lambert.com, roman.biz, brewer.org, griffin-donovan.com, neal.com, kennedy.com, velez-taylor.org",Thunderbird,fr,phishing
Erin Martin,smithsteven@gmail.com,jamestony@yahoo.com,Nation method break.,Data who condition member million. Today program just. Consider support different center any respond. Whom mother investment toward. Which child money your. Image strong sign arrive make.,2024-09-23 10:47:05,True,exe,5,"lawson-coleman.net, reed-glass.com, snyder.com, watts.com, jones.info",Gmail,es,legitimate
Michael Ramos,ryan66@chandler.com,oneillstephanie@cobb-nelson.com,Even already maintain night hold need.,Current area anyone get usually officer debate firm. Recently company drop agent sort wonder section. Change middle since also public member. Gun next allow sense line.,2024-09-12 01:05:26,False,none,8,"nolan.com, padilla-bryant.biz, russell.com, wong-king.com, harrison.com, powers-harris.net, vasquez.org, clark.net",Outlook,en,legitimate
Stephanie Murray,dannysmith@lindsey.com,ymiller@burnett-navarro.com,Since along develop financial.,Back must forward environment rock. Father grow only concern. Medical skill now however story police in. Around religious sign similar. We health account series couple. Away employee break soon.,2024-06-29 16:57:44,False,none,5,"pierce.info, ponce.com, allen.info, michael.info, beltran.org",Thunderbird,zh,phishing
Rachel Owen,yvette92@kelly.com,paula13@griffin.com,Knowledge player speech field happy tend.,Sport easy weight final language on. Evening trouble there herself wish. Pass capital enough nearly policy result offer.,2025-02-11 01:54:10,True,zip,4,"goodman.com, mathews-robinson.com, duffy.com, harris-cox.com",Yahoo,es,legitimate
Jason Munoz,johnweber@gmail.com,zanderson@gmail.com,Yes wall country more.,Many chair to both. Nearly mother thousand international may within coach. For management necessary beautiful help church. Key out when maybe avoid. For no keep recently. Message lay offer fire soon finally.,2024-10-30 02:37:51,False,none,8,"harvey.com, drake.org, whitaker.com, hall.com, stevens-schneider.com, saunders.com, murphy.org, barnett.biz",Thunderbird,fr,legitimate
Mark Frost,sarah65@yahoo.com,dturner@hotmail.com,Student let believe wrong stuff receive assume three.,Often international property trial receive. Dream word by. Call significant time exist floor book. Effect ahead maybe heavy.,2024-09-26 19:24:50,True,exe,1,harrison.net,Apple Mail,de,phishing
Terri Whitehead,laura36@gmail.com,iallen@hotmail.com,Political some also cover respond discussion still next.,Drive factor computer through note. Fire little remain audience. End whether purpose also individual figure. Beyond practice player pass yeah just sea. Whom fast down plant benefit stage tell. Hair others break within it.,2024-08-02 19:21:42,True,xlsx,10,"simon.com, johnson-potter.com, davenport-ramsey.biz, green-shepard.com, wright-beck.net, weber.com, powers.com, soto.com, harris-smith.com, callahan-ramirez.com",Outlook,es,legitimate
Brian Harris,hartdavid@yahoo.com,edwardsjames@hotmail.com,Couple program bar.,Write create buy would ahead phone. A power radio there air. Education threat tend west certain because shoulder. Manager ready art center reach skill. Audience peace test amount employee company future. Computer happy without brother.,2025-02-03 10:54:04,False,none,10,"lawrence.com, melendez-young.com, anderson.info, cooper.biz, taylor-richardson.com, joseph.com, cuevas.com, bass.info, villarreal.org, parks.com",Apple Mail,zh,phishing
Jessica Dixon,raymondedwards@miller-garza.biz,christophermelendez@hotmail.com,Product food yourself board suggest seem property.,Floor democratic left interest. I land value animal safe interview foot turn. Many where seem quality. Fish employee dinner drive. Election small real executive.,2024-07-01 01:21:52,True,exe,6,"davis.com, torres.com, cordova.org, rodriguez-haynes.com, roberts-lucero.org, hunt.com",Thunderbird,fr,legitimate
Leslie Jones MD,amyrojas@baldwin.com,thomashall@gmail.com,Difference bill price arrive customer house wear.,Behind wish professional work. Individual say along TV couple. Ever more customer option they responsibility treatment.,2024-07-28 14:11:17,False,none,5,"harris.com, fisher-kirby.com, young-conner.com, lynn-carter.com, sims.com",Yahoo,zh,legitimate
Shane Young,martin70@hotmail.com,sford@hotmail.com,Edge indicate hour.,Western ground record remember place girl simple. Off professor region continue player lead side. Behind brother almost lead result. Tough executive behavior level true add tend. Large down pull create. Travel debate might.,2024-05-18 04:07:19,False,none,7,"luna.com, dunn.com, ray.com, nguyen-anderson.com, nelson-wells.com, price.net, howell.com",Gmail,zh,phishing
Lauren Villa,morganmarquez@yahoo.com,lhayes@sawyer-rodriguez.biz,Half provide main activity agent.,Better win outside send dream her. Let head agent while tonight tough hand. Upon hope continue feel. Itself could those professional popular growth. Low term pull money high human on. Friend wear teach party military.,2025-03-14 22:13:14,False,none,10,"day.net, marquez.com, jefferson.com, miller.com, richards.com, kelley-valencia.com, huerta-johnson.net, kirk-pratt.com, elliott-perkins.com, gonzalez.biz",Gmail,en,legitimate
Debra Griffin,victoriasilva@hotmail.com,christopher71@gonzalez-poole.info,Join fly activity always.,Tax step his increase. Natural pull likely today if meeting artist. Field avoid hour time which value vote. Person program laugh magazine law.,2024-04-14 01:19:10,False,none,10,"allen.com, smith.com, morrow-gray.com, hudson.com, bennett.org, valencia.com, miller.com, fernandez.org, todd.com, boone.com",Thunderbird,de,phishing
Mary Ryan,griffindaniel@roach-wright.com,davidwilliams@hotmail.com,Occur once ability ground wide example.,Data that item foreign. Between late huge. City together station power.,2024-10-11 04:01:38,True,zip,4,"poole.com, berg.biz, myers-gray.net, burns.biz",Apple Mail,de,legitimate
James Gomez,ljackson@fernandez.com,amy40@yahoo.com,Camera effect deep reveal company glass.,Authority above investment person. Point black industry the. Between concern week traditional character. Without coach decade member. Couple anyone company rule hotel.,2024-04-22 05:14:42,True,exe,5,"strong.com, thornton.com, dorsey.com, dunn.biz, harper.com",Thunderbird,es,phishing
Dakota Farmer,bushlauren@holland-smith.com,tbarrett@gmail.com,Prepare coach back least.,Since second become so including. Letter share note dream. Middle decade end face. Might gun student region like market also degree. Cup investment message art there purpose. Push attack letter member customer exactly life understand.,2024-04-28 00:35:19,True,none,10,"jones.net, mann.net, carroll-garcia.com, welch-young.com, hayden-blevins.com, williams-ramos.com, brady.info, zimmerman.com, wright.org, robertson-green.com",Yahoo,fr,legitimate
Michael Edwards,julie72@cunningham-moreno.info,candace45@santiago.com,Professional wait none son establish dinner unit together.,Carry close factor six. Light nice professor produce church street of. Such keep card level. Lead name recently me away teach nation. Cultural summer pretty team pretty outside.,2024-12-16 20:53:13,False,none,7,"lee.com, contreras.org, allen-shepherd.biz, harrison.biz, turner.net, davis.com, summers.info",Thunderbird,fr,phishing
Maria Finley,mjones@hotmail.com,imiles@davis.net,Join think join arrive.,Hundred off keep student. Either build whole yeah give computer offer red. Article then rich kid nation wide. Show he shake home blue. Push sell wait model positive road join.,2024-06-09 10:15:26,False,none,0,,Outlook,de,legitimate
Julie Barnes,eric22@clark.info,whiterobert@collins-russo.com,Cause give movie against fall.,Class brother another phone fact. While read learn campaign young capital. Accept herself ever particularly herself player. Force window space want.,2025-01-01 04:26:02,True,xlsx,6,"rosales-rodriguez.com, evans.biz, farmer.com, murray-lewis.biz, moore.biz, thomas.biz",Outlook,en,phishing
Mary Villegas,shawn31@adams.com,tyler13@yahoo.com,Catch serious establish system.,Responsibility threat arrive. Style dinner us foot behavior. End write involve former mission poor.,2025-03-28 07:57:10,False,none,10,"grant.biz, johnson-medina.com, compton.com, olson.com, tyler-andrews.com, thomas.com, ross-dalton.org, russell.info, barnes.info, lopez.com",Apple Mail,fr,phishing
Victor Johnson,kingkathleen@charles-olson.com,millerbonnie@watson.biz,Mission there professor particularly street.,Young chance morning Congress international become. Onto natural source something available building unit. Ahead one data through statement interest administration.,2024-11-18 12:02:47,False,none,0,,Thunderbird,es,legitimate
Linda Chapman,robin25@gmail.com,nelsoncody@parrish.com,We probably position into wonder.,Join stock heart author pull. Role make who usually baby loss. Program front place. Stock century analysis. People yeah section well from. Finally chance move detail whom.,2024-07-16 02:45:43,False,none,0,,Yahoo,es,phishing
Mark Farley,charles61@everett.info,elizabeth05@hotmail.com,Land he tend whatever develop some.,No job sometimes board style baby movie. Floor why southern. Nearly week wait southern name smile account. Control project arm manager foreign until. Cause sell community consumer stay analysis receive somebody.,2024-06-11 19:26:47,False,none,1,munoz.info,Gmail,en,phishing
Harold Berger,kimberly47@hotmail.com,vrichardson@lee.com,Its everybody eat wife cost.,Country notice discussion former realize. Fall month film stop fly simply opportunity. Scientist understand relate statement.,2024-10-24 12:48:54,False,none,4,"hill.com, douglas.org, patrick.org, wright.com",Thunderbird,fr,phishing
Jeffery Ward,christopheranderson@yahoo.com,kimberlyaustin@yahoo.com,Sing significant off case rather.,Eat certainly stand. Position eat open decide back try go. Exactly practice back husband religious responsibility. Agency my political. Culture like become may particularly rate least. This open smile fall decision rock order.,2025-01-13 07:37:22,True,exe,7,"reynolds.org, hernandez.com, holmes.com, rivera.info, sanchez.com, sherman-trujillo.com, chen.biz",Yahoo,zh,phishing
Christy Lee,bhill@gmail.com,michellenelson@anderson.com,Physical forward six.,Let hospital certain what. Care certain manager matter sign population begin. Laugh these sign east reason. About approach media school position simply. Act technology wish visit behavior produce. Nice happen main law.,2024-08-10 15:39:44,True,exe,5,"cross-gardner.com, haney.com, walter-brooks.com, davis.com, livingston-bender.com",Outlook,fr,phishing
Aaron Zamora,awilliams@david-hernandez.com,amanda98@hotmail.com,Statement again seat style.,Modern special example pretty may firm wrong. Tonight source type ball. Fall police cultural our most create. Story if open recent remember. Home onto some listen discover. Player strong speak.,2024-11-10 15:57:22,False,none,0,,Yahoo,de,phishing
Kathryn Martin,bjackson@owens.info,allisonmartin@porter.com,Just spring to many should under window.,Forward allow suffer food. Finally include return over available. Attorney why detail notice option.,2024-10-22 02:56:55,False,none,1,willis.com,Outlook,fr,phishing
Stacy Carlson,nicholasfrazier@bean.com,gregoryroman@orozco-payne.org,Brother then rule bed why.,Question former treat population night. Guy serious free report activity nature medical. Lead through run side central. Case our north woman.,2025-02-22 11:39:53,False,none,8,"brady-crawford.com, gonzalez.com, meyers.com, hinton-ellis.com, shelton.org, wilkinson-nelson.info, espinoza.com, carter.com",Gmail,en,legitimate
Haley Willis,laura57@grant.com,zsims@hotmail.com,Here still paper science economic.,Dark protect fish up. Keep film find which hear skin through program. Reach growth later even. Base magazine thousand forget career amount. Everyone various sure wait debate either. Brother wide owner attorney fact place old.,2025-03-08 21:56:37,False,none,2,"knight-lewis.com, meyer.com",Thunderbird,fr,phishing
Carol Russell,christinamccoy@yahoo.com,robertskenneth@gmail.com,Peace theory behavior owner.,The new we evidence. Theory what win since. Cut dog partner unit who particularly small. Water man become hair.,2024-04-26 06:56:15,True,pdf,4,"beck.net, owens.com, page.com, stafford.com",Yahoo,es,phishing
Brian Ramirez,xallison@gmail.com,jessicabeard@franklin-henry.net,Detail cost bad.,Radio member head true. Country field since animal health less article. Popular young decision easy second accept system. Officer various scientist range social direction. Ground really writer city consider somebody. Really community project appear.,2024-07-02 17:25:12,True,exe,1,smith.info,Yahoo,fr,legitimate
Patricia Hill,whitejeremy@yahoo.com,rhart@gmail.com,Character set wall rule term church around.,Involve car produce. Story article boy drug knowledge tax. Yet international kind industry face defense. Few public attorney analysis chair friend work likely.,2024-12-17 15:07:44,False,none,7,"oconnor.com, underwood.info, robinson.com, rogers-hernandez.info, maldonado.com, mason.com, reynolds-sanchez.info",Thunderbird,zh,phishing
Brooke Moss,benjamin71@hotmail.com,sandra40@yahoo.com,Every or religious turn.,Actually all my happy dog name. To citizen plant whether main car speak. Brother either media piece. Another feel return TV base certain population.,2025-03-12 04:35:03,False,none,6,"wilson.info, rose-woods.org, wall.com, silva.info, bullock.com, espinoza-morrison.org",Thunderbird,en,legitimate
Stephanie Jones,zmichael@yahoo.com,jennifer24@farrell.info,And science wife nature pretty.,Seek energy already later power law their. Everybody the always appear visit as few day. At pick within amount son sense order. No contain baby general agreement painting. Address whose cause hold campaign measure situation. Provide thus car campaign official cover kid.,2024-09-19 23:35:58,False,none,0,,Outlook,fr,phishing
Mathew Haas,nking@king.net,robertjohnson@lindsey.biz,Study activity remain discussion prepare cup option.,Left forward contain tree now affect. Already about only. Hour improve should several green security possible. Opportunity successful material our.,2024-06-03 23:13:39,False,none,1,mcdowell.com,Gmail,fr,phishing
Sarah Allison,harveyangelica@yahoo.com,michaelmcfarland@church-king.com,Land character improve animal.,Share data soldier ball member. Opportunity performance affect establish Mrs. Way wear already shoulder.,2024-05-27 20:59:42,True,none,1,horne-garza.net,Thunderbird,zh,phishing
Tiffany Sutton,cooperjimmy@gmail.com,morrowkathryn@woods-roberson.org,Success strong question star into.,Once best since skin attention how type. Bring space former Democrat research. Tax also institution tend look commercial. Mission make out possible. Office card piece audience pretty partner actually once.,2024-09-18 22:02:25,False,none,3,"evans-wagner.org, macias.com, phillips.com",Yahoo,zh,legitimate
Jennifer Estrada,patrickchavez@gmail.com,jacob27@young.org,Prevent happen who reality.,Left leg over manage least best. Buy no born baby of her. Former page develop join sea.,2024-07-02 16:51:09,False,none,8,"robinson.info, richardson.com, hines.info, thomas.org, rodriguez-murphy.org, wheeler.biz, walker-graham.com, evans.com",Thunderbird,zh,phishing
James Kelly,pturner@duran.com,qjoseph@yahoo.com,Draw task prepare loss yard decade.,Play financial white parent sort form theory. Skill blue Democrat past already gas. Lay parent product to. Election join hard exist page out record. Air building force series. Necessary yard person upon no possible type.,2024-10-23 09:41:05,False,none,9,"allen.info, young.com, guzman-rhodes.com, lowery.com, brown-newman.com, rogers.net, pearson.com, munoz.com, wang.com",Apple Mail,zh,legitimate
Stephanie May,pwilliams@foley-evans.info,kboone@hotmail.com,Tend computer although decade.,Card raise authority agree consumer. Gun senior much those main finally hold. Carry social message three letter policy trip. View lay author large report shake. System office owner seem. Office develop friend service hand name.,2024-09-05 13:25:50,False,none,2,"barber-johnson.net, smith.info",Thunderbird,de,legitimate
Cynthia Jones,keith49@yahoo.com,mrhodes@mclean-thompson.com,Door region experience matter public so there.,Bring after resource national. Network artist agency evidence traditional. Bit develop station pay sell save start. Bag his value great meeting memory.,2024-08-27 23:54:44,False,none,7,"oneill.com, williams-bowen.com, pope.com, spence.info, robinson.com, mcclure.info, delgado.com",Apple Mail,en,phishing
Joseph Anderson,garzakimberly@gmail.com,zhanggarrett@yahoo.com,Animal partner specific many score section.,Ability consider manage security product side. Tax common understand after reality population agent several. Follow life someone us responsibility thank me.,2024-05-25 10:19:50,True,xlsx,10,"carroll.com, reed.biz, townsend.com, jackson.com, johnston-gilbert.biz, pena.com, johnson.com, herrera-sanchez.info, jensen-moore.org, howell-henderson.biz",Apple Mail,es,legitimate
