Sender_Name,Sender_Email,Recipient_Email,Subject,Email_Body,Timestamp,Has_Attachment,Attachment_Type,URL_Count,URL_Domains,Email_Client,Language,Label
Paul Mcmahon,erinthomas@thompson.com,michelleallen@gmail.com,Street service these pretty.,Station week allow security. Method research thank itself red sense. Another condition local some evening thank. Blood hotel accept wait start cup. Any example generation around film be despite. Us half speech man.,2024-10-27 21:51:41,False,none,4,"jordan-mills.com, wilkerson.org, hernandez.com, simpson.biz",Apple Mail,es,phishing
Joshua Hutchinson,ambergreen@yahoo.com,willieweaver@yahoo.com,Movie point image because traditional.,Image put late amount huge whole office. Town real best kind democratic service either something. Democratic now yard sport public political. Build base likely student bed gas. Throw cover deep hundred media never. Human opportunity wife one place blood. South more year hard future key address think.,2024-04-28 02:32:11,True,none,9,"fernandez.biz, smith.org, coleman.com, wilkerson.com, stanley-guzman.com, williams.com, lee.net, smith.org, silva.com",Gmail,zh,phishing
Victoria Mcgee,mullinsbrendan@hotmail.com,svasquez@green.com,Third leg most soon.,Tree military kitchen not system watch husband actually. Statement charge station give learn imagine water. Should project single.,2024-12-06 04:23:31,False,none,0,,Gmail,fr,phishing
Troy Watts,robertsjordan@hardin.com,david99@gmail.com,Respond structure police grow month believe might security.,Worker cost manager note put bit. Easy contain if wonder decade fight. Thank exactly trial manager common. Grow himself respond different majority character.,2024-04-14 13:45:19,False,none,0,,Yahoo,es,legitimate
Louis Caldwell,kristinserrano@yahoo.com,orodgers@yahoo.com,Add phone professional which.,Fall security west rest reach charge second. Section everyone resource race hold where. Magazine address stay early age hot glass. Peace deal floor above fill these if. Think eight hundred bank list. Include help local game help.,2024-10-22 10:20:23,True,docx,1,davis-smith.org,Gmail,de,phishing
Richard Cooper,tinarogers@martinez-gonzalez.com,thomas12@cunningham-thompson.com,Should back share loss floor table phone voice.,Film however they talk. Style make Mrs. Soldier may fear outside. Music range garden financial land around. Material only happy oil couple ability. Suddenly clearly where room.,2024-04-18 11:47:53,True,none,7,"farmer-glass.com, lopez.com, arias.com, parker.net, conley-irwin.com, lee.info, davis.biz",Apple Mail,zh,phishing
Isaac Jacobs,ggonzales@fletcher-graham.com,danielbarry@smith.com,Receive father low.,Player defense not think accept case develop. Which result green. However bit rest large again dark resource. Executive point protect big. Available raise military find dinner within. Represent mother similar force.,2025-02-20 23:22:09,True,pdf,4,"klein.com, hawkins-smith.com, villarreal.com, king.com",Yahoo,zh,legitimate
Stephanie Trujillo,cassandrasheppard@turner.com,alexandriagilbert@yahoo.com,Power term claim former much respond somebody.,Network American treat camera prove. Material whom agree sure almost wonder Democrat prove. Measure country require account white protect type.,2024-07-13 05:15:38,True,pdf,5,"garcia.com, barton.info, young.info, schultz.biz, ortiz.net",Yahoo,de,legitimate
Thomas Barnes,rachel60@gmail.com,browncaroline@gmail.com,Exist product public wonder professor particular.,Organization various Mrs machine as turn reality. Every out when wait. Attorney ever experience might agreement cut same. Apply deep special send civil production. He always believe democratic.,2025-01-09 23:19:51,True,zip,3,"barr.net, humphrey.net, richardson.com",Thunderbird,es,legitimate
Benjamin Snyder,xthomas@yahoo.com,ufitzgerald@lopez-ortega.com,Want save husband move because.,Including since if occur miss beautiful their notice. Soldier similar mind history. About personal entire development research. Mother network plan culture produce yet.,2024-10-02 19:32:12,False,none,0,,Thunderbird,zh,legitimate
Matthew Myers,bretthawkins@adams-smith.info,eric05@butler.com,Force local financial.,Media name begin must college cost. Manager course drive sing right choice particular. Administration someone themselves record. Fish fine market apply color. Interesting best suffer speak these lead law.,2024-07-06 07:16:01,True,xlsx,6,"guzman-wu.com, gill.org, taylor-spears.com, sandoval.biz, acosta.com, myers-hernandez.com",Gmail,en,phishing
Austin Garcia,colleen47@gmail.com,bschultz@gmail.com,Quickly picture enough dog.,Difficult assume movie throughout rise. Painting head oil news computer he rise. Go maintain real decade week. While dinner practice build. Company identify speech admit room mean trial.,2025-02-04 10:52:06,False,none,0,,Gmail,zh,phishing
Joseph Booker,russelllandry@buck.com,stevenmcgee@cain.com,Same standard sure paper industry thing pressure.,Baby skin vote claim computer whatever take news. Politics station catch ever change nearly movement. Nothing report next. Explain else dog she. Himself last lay article risk century interesting.,2024-11-17 10:41:04,False,none,2,"green-escobar.com, mayer.net",Apple Mail,en,phishing
Ashley Green,palmerlauren@simon.com,zacharypeters@reese.com,Blood see despite conference choice.,Contain outside section performance return center door. Fire what over skin. Fear although thought center. Couple south dream soon message.,2025-03-21 08:27:39,False,none,5,"whitehead.com, randolph.net, harris.net, cabrera.com, jones.com",Gmail,zh,phishing
Stephen Holmes,omarfreeman@scott.biz,ogilmore@freeman.net,Put local easy only.,Others they become then around throughout near day. Here ten career whole card. Mission simply since fill result.,2024-06-07 00:53:22,True,docx,10,"davis.com, brady-fox.com, kennedy.com, white-vaughn.com, rodriguez-silva.com, grimes.com, castillo.com, silva.com, frey-weber.info, johnson.net",Gmail,fr,phishing
Dylan Jimenez,bakersusan@yahoo.com,woodjennifer@duran.biz,Building successful he opportunity challenge whether fear several.,Focus particular try itself knowledge film. Decade response step suddenly people. Minute sport simple lose. Chair green maybe investment. Debate decade ago necessary expert. Already ok race tree friend.,2024-12-03 06:27:51,False,none,7,"ross.com, blankenship.com, jackson.com, lewis.org, rodriguez.com, cox.com, fischer.com",Gmail,de,phishing
Catherine Velasquez,ugardner@yahoo.com,richardsoncindy@yahoo.com,Memory simple field age office political fear series.,Visit sister tend particularly station opportunity. Hold employee grow culture build. Identify give reality. Sort pull training create see firm court sport. Offer treat minute himself race commercial. Shake peace something drop.,2024-04-23 04:39:59,False,none,1,mills.net,Yahoo,de,phishing
Justin Johnson,ekirby@freeman.com,watkinsjohn@mitchell.biz,National book network mother body free thousand.,Feel me upon. Majority officer from head yeah marriage herself. Party for member nearly medical. Perhaps ever magazine provide within thing win. Important order two once military very.,2025-02-05 22:45:15,False,none,5,"fernandez.com, hudson.com, rubio.com, taylor-carr.com, mitchell-patel.info",Outlook,de,phishing
Julia Conway,robert29@gmail.com,melinda86@hotmail.com,Center far from actually memory treat.,Treat mention collection rise sort. Of girl environment race you. Else poor range claim have provide task. General smile game method candidate simply break.,2024-10-19 00:28:55,False,none,3,"cruz.com, dixon-oliver.com, murray.net",Yahoo,en,legitimate
Kyle Harris,thomasmartin@herman.com,yboyd@hotmail.com,Smile their current will.,Police available among many structure experience thousand. Strong base focus big left. School point third pattern point add show.,2024-07-22 05:29:47,True,pdf,10,"tyler-hall.org, estrada.com, harmon-brewer.com, daniels.com, robinson.com, ramirez-morales.org, marshall.org, nichols.com, calhoun.biz, weber.com",Gmail,de,legitimate
Mary Anderson,terrymary@hayden-walsh.com,damon72@haynes.com,Daughter cause approach common woman increase.,Admit television senior son. Loss nearly capital idea citizen a appear. Real check deep item staff live baby remember. Case class important all your view carry. Note will project mention they surface. Hotel sure world score free.,2024-06-05 06:59:43,False,none,3,"franco.biz, peterson.biz, osborn.net",Outlook,es,phishing
Stephanie Smith,chunglauren@harmon.info,grossashley@rodriguez-johnson.info,State issue oil left effect.,Economy office both same. Summer strong land manager society. Hold high his task. Talk simply west traditional according parent close determine.,2025-04-04 11:11:24,True,none,10,"rivera-ryan.com, brown-mcguire.info, gregory.com, mahoney.info, harrison.com, anderson-taylor.info, turner.com, valentine-wilkins.org, adams.org, scott.com",Apple Mail,en,legitimate
Mary Howard,christine00@alexander-moon.org,richard63@hunter-davidson.com,Court business business.,Couple goal technology senior magazine either usually. Radio school commercial reveal run such work. Population want everything place imagine care.,2024-08-06 22:02:39,False,none,8,"gilbert-johnson.com, lawson.net, flores-higgins.org, mathis-fitzpatrick.com, allen-johnson.com, bond-scott.com, cisneros.org, flores-ramirez.biz",Yahoo,de,phishing
Christopher Smith,nhart@yahoo.com,valeriewilson@hotmail.com,Stand bed mean oil theory building.,Down realize call reflect woman represent pay. Make total consider loss despite. Run reveal pattern character left book test.,2024-07-11 17:59:17,False,none,0,,Outlook,es,phishing
Curtis Brown,ericavasquez@castaneda.org,frankbush@gmail.com,Stop current window as.,Could hour people decade condition should add. Truth bring base six assume computer partner edge. Issue condition threat phone. Change start read.,2024-06-14 15:24:06,False,none,2,"berg.biz, rodgers-gutierrez.com",Thunderbird,zh,phishing
William Cortez,kguerra@yahoo.com,shannonmorgan@owens-duran.net,Challenge chair role help on dog.,Instead war live fly hair team majority town. Race than movement. Staff cost commercial with. Technology you nice fall. Agency whole language stand. Class identify close race travel account staff help.,2025-01-17 08:57:54,False,none,6,"dawson-carlson.com, prince-hill.com, huff.info, patterson.com, gonzalez.biz, schultz.info",Apple Mail,de,legitimate
Maria Delgado,kimberlyhall@hotmail.com,rhurst@hudson.org,Southern else debate ever dinner minute.,Will happy house consider rest its difference. Eye through although nothing paper. Soldier happen test available. Already drive cup smile newspaper.,2024-12-27 12:44:56,True,none,9,"gonzalez.org, farrell.com, wise.org, chavez-jordan.com, carter-byrd.com, griffin.com, williams.net, erickson.net, scott-lopez.com",Yahoo,de,legitimate
John Johnson,ncooper@gmail.com,zcastillo@alexander.com,Tonight laugh add feel ball seek.,Might store election cell your. According show particularly matter out. Center near owner hour city set onto focus. How among support will machine off. East important focus nor including.,2024-10-09 15:16:45,True,docx,6,"shea.com, lee.org, sparks.com, rivera.org, espinoza.com, underwood.com",Apple Mail,fr,phishing
Jared Allison,kylewilliams@smith-phillips.com,mistysnyder@clark-weaver.com,Student travel similar whom.,This day conference. Agreement our side add thank produce that. Line article table those.,2024-07-24 23:46:33,False,none,10,"harrington-johnson.info, bennett.net, rice-patterson.info, hawkins.biz, becker.info, wright.com, leach-pineda.com, lowe.net, thomas.com, white.com",Gmail,fr,phishing
Natalie Dominguez,sharon20@gmail.com,wsimmons@shelton.com,Fast positive north discussion.,Must central sea physical. Agreement teacher call always century use. Unit account PM child. Final go actually fast my local.,2024-10-21 04:08:29,False,none,10,"saunders.com, lewis.com, miller.info, chen-baker.com, ford.org, murray.org, thompson.com, rodgers.com, fisher.com, rodriguez.com",Gmail,de,phishing
Teresa Burns,montgomeryadam@porter.com,kerry56@yahoo.com,Pass deep whose car.,Republican not usually become commercial increase. School second community camera represent nearly let. Check Congress best thus less game develop dark. Seven purpose health itself become remain market conference. Necessary mind parent it.,2024-07-24 08:27:23,False,none,4,"bowen-turner.net, carroll-franklin.info, collins-patton.net, scott.net",Gmail,es,legitimate
Gregory Joseph,douglasvang@yahoo.com,zacharygonzalez@gmail.com,Protect section air air special control.,Where kid everything. Once expect whole agent effort effort red. Billion gun woman quite rate senior lay. Beyond staff life impact race to significant.,2024-04-12 04:41:44,True,none,3,"lewis-cox.com, mendez.biz, collins.com",Apple Mail,de,legitimate
Steven Torres,gregorydiaz@yahoo.com,wyork@yahoo.com,Do character whom sound.,Laugh identify because author bank quickly. Back such leg street leader drive. Interview air woman collection exist property.,2024-05-12 03:11:11,False,none,1,livingston.com,Outlook,de,legitimate
Kathy Oconnor,vaughnemma@yahoo.com,josephgonzalez@hotmail.com,Trade thought several along street buy about.,Commercial tree answer less apply leave pretty. Machine hair hair over positive. Next work push evening military. Food support project contain. Executive field quite.,2025-01-05 01:17:49,True,xlsx,5,"sims.info, warren-sullivan.info, parker-hess.com, davis.org, davis.com",Outlook,zh,legitimate
Michael Johnson,ellisshawn@martinez-marks.net,greenjoseph@blake-payne.org,Husband hope report according ball answer.,Include impact son despite where effect whether. Article office reason theory. Keep property prepare. The wish compare PM cup away more. Short machine pull for high suggest choice. Strong him free still music thus hit go.,2024-09-28 23:40:03,True,exe,4,"crawford.com, robinson.com, boyle.com, smith.org",Gmail,fr,legitimate
Brittany Hunt,marypearson@underwood-rodriguez.com,scott41@garcia-martinez.com,Meeting bring pretty my true next just.,Affect never special with require newspaper. Office eat style question. Issue list after would manager service call dog. Argue energy threat discover political.,2024-11-23 23:07:50,False,none,2,"simmons.org, solomon.com",Outlook,zh,legitimate
James Williams,peter57@hotmail.com,xvega@hernandez.com,Plant region sign note doctor safe Congress interview.,Explain official knowledge anyone little. Base theory enjoy box guess home. Tax save where tell experience indeed campaign. That visit though among age movie. State true themselves family suffer senior.,2024-07-22 05:24:17,True,exe,4,"pope-peterson.com, miller.com, hill.com, schroeder-anderson.org",Apple Mail,en,phishing
Kenneth Carlson,coreyscott@gmail.com,williamskrystal@leach-willis.com,College their box power.,Mouth health north number measure. Least maybe serious she possible. All pay age today yard. Vote political piece treat time after amount. Large might edge very find. Family evening everyone style audience. Make feeling later.,2024-12-14 04:05:56,True,zip,9,"vasquez.com, flowers.info, hahn.com, hutchinson.com, richard-smith.com, boone.com, zamora-munoz.com, salazar.com, berg-mcpherson.com",Yahoo,en,legitimate
Troy Kennedy,vegadaisy@yahoo.com,pwatson@gmail.com,Remember develop read manage.,Catch industry if across. Example third good expert soon eye article. Provide enough position a. Record size bank generation. Him this chair them third foreign.,2025-02-07 05:34:26,False,none,9,"marshall.com, miller-williams.com, franklin.org, swanson.com, williams.biz, chase.com, soto.com, cox.info, ward-hernandez.com",Outlook,zh,phishing
Dana Taylor,fishergregory@yahoo.com,kdawson@hotmail.com,Yes seven collection already house.,Democrat player security your arm. Benefit mission wind. Discuss tonight bar coach stay. Back out fund once. Until under give although arrive.,2025-03-16 20:06:07,True,none,9,"bautista.net, wood-murphy.info, barnes.net, baker.com, bryant.com, brown-li.com, townsend.com, lucas.org, hernandez.biz",Thunderbird,de,phishing
Maurice Santiago,garnerrobert@yahoo.com,kevin19@hotmail.com,Truth hear forget help most.,Physical deep enough fear level drug. Kitchen girl science night material card. Painting sense crime lose business better.,2024-09-26 19:46:08,False,none,0,,Yahoo,zh,phishing
Jennifer Lloyd,tdunn@moore.net,msexton@holmes.biz,War list somebody money.,About woman air language continue. Probably buy guy. Individual need goal author. Rise yard determine yet. Shoulder benefit far possible.,2024-09-15 22:12:33,True,xlsx,5,"cox.org, martinez.com, rosales.com, brown.biz, johnson-contreras.net",Gmail,de,phishing
Adam Ortega,brittany67@evans.info,anthonytorres@gmail.com,Gun rock star already success himself either.,Degree right fill. Those list appear expert. All another sit someone. Arrive young matter stop education teach their. Parent official language series now.,2024-07-06 07:31:21,True,exe,10,"torres-gonzalez.com, peters.info, evans-peterson.com, lee.net, cox.biz, torres.com, ramos.com, snow-thompson.org, lopez.com, frank.com",Outlook,zh,legitimate
Karen Allen,stephanie47@hotmail.com,lambdonna@hotmail.com,Everything success somebody bank she.,Answer cover over more window hundred sport likely. Somebody own radio own. Day bill send sit. Country discuss smile north American lay. Strong inside manage modern right join me agree. Top wait note here create month.,2025-02-14 06:59:12,False,none,2,"ball.info, flynn.biz",Apple Mail,zh,legitimate
Lauren Santana,bookerjessica@horton-johnson.com,vegadavid@hotmail.com,South story child western.,A scene check order able of response majority. Agency new Congress rise successful college book. And design mother response west success share. Concern term sound mind. Analysis grow probably yeah north worry. Decide key at front cup sort.,2025-01-28 15:27:20,False,none,5,"harrison.net, cox-martinez.com, parker.com, holden.com, ford.com",Thunderbird,de,legitimate
Laurie Michael,eburke@smith-zimmerman.com,elizabeth13@yahoo.com,Space investment stand prove computer.,Against since how break. Let require different. Not forget parent wrong upon everything. Power exactly put paper news full customer. Quite increase body take. Improve power total common still occur style.,2024-08-05 09:01:12,True,zip,7,"nunez.com, peters.biz, reynolds.net, paul.org, snow.com, vaughan.biz, coleman-king.org",Apple Mail,fr,legitimate
Robert Johnson,edwardholland@gmail.com,melissacoleman@roman.biz,Enjoy decade read fast place how suggest.,Hard natural establish own have. Window pay main moment. Save something second. Benefit memory certainly agent growth note professor own. Final stand research fund tonight. Big scene crime expect a career space young.,2025-02-03 07:56:45,False,none,5,"bailey.org, webster-bates.net, watson.com, clark.net, jackson.info",Gmail,zh,legitimate
Robert Cobb MD,riggsjames@yahoo.com,wadedaniel@yahoo.com,Just protect ball rest start.,Wide director try conference interest hand. Take else behind. Feeling carry keep before now real into.,2024-10-29 15:56:42,False,none,3,"miller.com, rodriguez-lane.biz, collins.com",Yahoo,fr,legitimate
Sarah Hoover,youngmelissa@malone.com,kyle87@hudson.org,Family prevent out any blue per.,Nearly at chance help take medical. Bar note actually feeling. System very save person whom parent sea. Discover interest protect. Important glass material simple include remain. Pull system decide worker.,2024-08-17 09:26:31,True,docx,9,"ryan-cooper.com, scott.com, dean.com, campbell.com, nelson-miranda.com, jones.biz, pena.info, cox.biz, andrews.com",Yahoo,de,phishing
Jennifer Craig,charlesroberts@crawford.info,tyler57@gmail.com,Consider professor save them present nothing card result.,Fly economic build big alone responsibility account. Question role choice eight able yourself type. Responsibility doctor like piece court ground sport. Economic actually else low. Show card exist person develop. Game third want decision tonight scientist perhaps there.,2024-05-17 05:17:09,True,exe,10,"kent.com, fields.com, sherman-green.com, jones-wiley.com, walker.com, macias.com, combs.com, miller.com, moore.net, hoffman-conner.net",Outlook,de,legitimate
Audrey Carpenter,sullivantodd@gmail.com,jmurillo@may.net,Boy simple condition environmental focus PM military.,Himself reduce appear true. Hotel past you huge subject hot small. Until become rather. Machine feel same military maybe management.,2024-08-29 22:23:00,False,none,7,"adams.com, watson.info, schmidt.com, duffy.org, pham.com, davis-montgomery.com, johnson.biz",Thunderbird,fr,legitimate
Dale Wood,oarmstrong@gmail.com,owenjeffrey@wilson.com,He miss hundred condition.,Far nature arm foreign support. Democratic book six film enough. Thank between bad daughter Congress least hotel.,2024-04-15 02:32:28,True,pdf,0,,Yahoo,de,legitimate
Angelica Ramirez,mthomas@hughes.com,troy74@compton.com,First investment sister area result building.,Explain quite minute image eye particular financial which. May surface thing happy single. Off several cut religious. In likely think have suddenly business trial. Cut church it throw development stage book.,2024-04-12 10:12:42,False,none,1,gill-ali.info,Yahoo,zh,legitimate
Jimmy Hudson,andrew83@guerrero.com,gsims@yahoo.com,Mind when price yard ok consider president body.,Responsibility plant peace reality less new. Attorney give window American hit hundred bad. Imagine southern always president including. However civil together it seek. Executive quickly task wide provide face he ever.,2024-04-15 03:09:32,True,docx,0,,Outlook,zh,legitimate
Samuel Rice,janet84@ward-alvarez.com,williammarsh@robinson-harris.com,Space one those.,Chair matter education hot all federal. Institution identify response important catch new. Power first suggest above. Account data wait scene reach middle.,2024-09-15 19:35:07,False,none,10,"bullock-acosta.com, thomas-houston.com, johnson-murray.com, thomas.info, perez-johnston.com, yoder.com, navarro.com, pena.com, orozco.net, fitzpatrick.net",Apple Mail,zh,phishing
Gary Smith,coxamanda@hotmail.com,urichmond@morris-carter.biz,Two religious available.,Once collection choice cause maybe. Member long perhaps rock message. Point charge boy. Probably determine write seat final yet. Play develop wonder fish.,2024-08-03 01:07:13,True,zip,3,"clark-brown.com, gardner.com, jones.org",Thunderbird,zh,legitimate
Heather Thompson,bbarker@watts.org,qtownsend@yahoo.com,Pass Mr former practice.,Dinner speak personal who sing pay reflect. Stay rock accept drive some skin deal. Pressure property identify describe add term serious truth. View should political out discussion discover it wish. Matter put money young camera report.,2024-09-06 23:36:23,True,xlsx,8,"hobbs.com, daniels.com, alvarado-kennedy.com, meyer.com, strong.com, hale.com, eaton.org, walls-turner.net",Gmail,de,phishing
Mark Kirby,fryeangela@duke.org,gerald91@gmail.com,Fish enough goal.,Television appear maintain goal. Camera particularly body bag effort indicate again. Better artist wish door bank less. According own beat may something loss.,2024-10-07 18:18:53,False,none,4,"johnson-rodriguez.com, powell.com, bryant.net, webb-johnson.com",Thunderbird,es,phishing
Wanda Martinez,nhudson@hotmail.com,riverasergio@yahoo.com,Much sort area safe site.,This audience note least too. Purpose response shoulder find. Behind cultural Congress brother whom book benefit open. Yeah seem public city day. Read offer price. Side must would address expect evening.,2024-07-05 11:34:42,True,pdf,5,"herring-swanson.com, tate.net, cruz-lawrence.org, robbins.com, kemp.com",Yahoo,de,legitimate
Jasmine Hernandez,williamsjennifer@washington.com,jerry83@hotmail.com,Return peace deal authority east recent movement.,Buy source style knowledge. Perform cell although training baby either ten half. Full gas agent serve. Then western result she unit clearly could. Later guy remain eat.,2024-04-29 20:12:28,False,none,0,,Gmail,zh,phishing
Kyle Pennington,danielkatherine@yahoo.com,uedwards@gmail.com,Girl sing where before him.,Thus eye evening different century. Evidence street spend result maintain. Mr citizen although camera take. Democrat partner garden right night suffer wall. Hair short avoid not other particularly use turn.,2024-05-23 03:35:47,False,none,2,"lee-crosby.net, baker.com",Thunderbird,zh,phishing
Craig Hudson,rtate@jackson.com,bartlettdrew@hill.com,Stop surface hair represent truth manage.,Accept time effect state. Opportunity food happen shoulder weight it. Behind really security recent. Father dream black energy. Tough argue appear. Across soldier central major.,2024-09-11 12:59:25,False,none,7,"joyce.biz, abbott-gordon.com, gutierrez.net, roy-meyer.com, sanders.biz, robinson.com, frederick.com",Apple Mail,en,phishing
Gabrielle Brown,johnnewman@hotmail.com,bradleyyoung@schneider-goodman.com,Follow take research cold decision section TV.,Outside compare area toward. Four participant maybe agree rock agent. Feeling trouble truth series under international nature. Data coach hotel very. Successful information case read effect decision force interest.,2024-07-21 17:51:50,False,none,2,"mendoza.com, johnson.com",Gmail,de,legitimate
Jeffery Williams,richard51@silva.com,gerald58@collins.net,Wind chair soldier.,Might thank difference raise police city girl. Section certain force wrong. Operation forget writer probably mean them. Stage particularly determine. Task commercial professor exist rich effect hit. Activity also else show.,2024-05-05 16:10:44,False,none,1,fields-parrish.net,Outlook,de,legitimate
Monica Lara,jesus51@yahoo.com,hurstann@rasmussen-church.com,There likely pressure part life.,Spring myself purpose anyone stock region. Size determine none. Name local perform discover most. Dark drop professor five main from. Skill treatment art. Most candidate author town.,2024-04-21 22:17:46,True,docx,4,"robbins.net, moore.biz, wright.org, hall-barker.com",Outlook,es,legitimate
